ASIN,MRP,aplus_images,aplus_text,attributes,best_sellers_rank,brand,bullets,collection,country_of_origin,date_first_available,department,description,discount,image_links,important_info,importer,is_discontinued_by_manufacturer,item_height,item_height_unit,item_length,item_length_unit,item_width,item_width_unit,material,metal,model_number,net_quantity,offers,packaging,packer,price,product_path,ratings,ratings_count,special_offers,stone,title,type_of_offers,url,video_links,warranty_type,weight
B09X48RT33,"2,697","https://images-na.ssl-images-amazon.com/images/G/01/x-locale/common/grey-pixel.gif,https://m.media-amazon.com/images/S/aplus-media-library-service-media/3b07b53c-2704-43a7-acd2-62490c9a8b01.__CR0,0,970,600_PT0_SX970_V1___.png,https://images-na.ssl-images-amazon.com/images/G/01/x-locale/common/grey-pixel.gif,https://m.media-amazon.com/images/S/aplus-media-library-service-media/bcfaf91d-8759-4de9-8be8-c7e7a1488fd9.__CR0,0,970,600_PT0_SX970_V1___.png,https://images-na.ssl-images-amazon.com/images/G/01/x-locale/common/grey-pixel.gif,https://m.media-amazon.com/images/S/aplus-media-library-service-media/65a602e9-1453-4268-bd14-1e5fbf1062c3.__CR0,0,970,600_PT0_SX970_V1___.png,https://images-na.ssl-images-amazon.com/images/G/01/x-locale/common/grey-pixel.gif,https://m.media-amazon.com/images/S/aplus-media-library-service-media/21176b26-cc9a-4986-aef8-6637a5aa1d4b.__CR0,0,970,600_PT0_SX970_V1___.png,https://images-na.ssl-images-amazon.com/images/G/01/x-locale/common/grey-pixel.gif,https://m.media-amazon.com/images/S/aplus-media-library-service-media/8558e2ca-a77c-4d96-946c-ccb05be9e389.__CR0,0,970,600_PT0_SX970_V1___.png,https://images-na.ssl-images-amazon.com/images/G/01/x-locale/common/grey-pixel.gif,https://m.media-amazon.com/images/S/aplus-media-library-service-media/69cacb1d-7bf4-4daa-8d1a-a682db4c6e8a.__CR0,0,970,600_PT0_SX970_V1___.png",,,,," COMFORTABLE : When babies are swaddled, they sleep better & feel safe as babies are used to being wrapped tightly in the womb. Bamboo Fabric is weightless & thermo-regulating which helps to regulate the body temperature based on the weather.  , SOFTER THAN SOFT : The bamboo fabric is super-soft and gentle on your baby’s skin. The soft plush fabric wraps around your baby for a comfortable sleep. It is also the best choice for rash prevention.  , MULTIPURPOSE : Mush Bamboo Swaddles can be used as a play mat, a blanket, a burp cloth, a nursing cover, a picnic blanket. It is one of the best baby shower gifts for every new mom.  ",,,,,,52%,"https://m.media-amazon.com/images/I/41giCBA8waL.jpg,https://m.media-amazon.com/images/I/51pApkFhhTL.jpg,https://m.media-amazon.com/images/I/412se8aaIbL.jpg,https://m.media-amazon.com/images/I/51hEMPKkv5L.jpg,https://m.media-amazon.com/images/I/41-vX9PreFL.jpg,https://m.media-amazon.com/images/I/41X8uArTFyL.jpg,https://m.media-amazon.com/images/I/41gCzb8YsoL.jpg",,,,,,,,,,,,,,"Avail No Cost EMI on select cards for orders above ₹3000,Upto ₹97.42 discount on select Credit Cards,Get GST  invoice and save up to 28% on business purchases.",,,"1,299",Back to results,4.6,35 global ratings,,,"Mush 100% Bamboo Swaddle : Ultra Soft, Breathable, Thermoregulating, Absorbent, Light Weight and Multipurpose Bamboo Wrapper / Baby Bath Towel / Blanket(3, Golden Leaf, Jungle (Colorful) & Sea (Colorful)"," No Cost EMI , Bank Offer , Partner Offers ",https://www.amazon.in/dp/B09X48RT33,,,
B07CW1BJQY,"2,199","https://images-na.ssl-images-amazon.com/images/G/01/x-locale/common/grey-pixel.gif,https://m.media-amazon.com/images/S/aplus-media-library-service-media/1467acbb-b3f6-4838-9644-21e79a9a290e.__CR0,0,970,600_PT0_SX970_V1___.png,https://images-na.ssl-images-amazon.com/images/G/01/x-locale/common/grey-pixel.gif,https://m.media-amazon.com/images/S/aplus-media-library-service-media/44f22423-b851-4638-a058-22132b30470e.__CR0,0,970,600_PT0_SX970_V1___.png,https://images-na.ssl-images-amazon.com/images/G/01/x-locale/common/grey-pixel.gif,https://m.media-amazon.com/images/S/aplus-media-library-service-media/b9b2f4e6-5f20-44cd-a86b-0fc2dc4983f6.__CR0,1000,2000,2000_PT0_SX300_V1___.jpg,https://images-na.ssl-images-amazon.com/images/G/01/x-locale/common/grey-pixel.gif,https://m.media-amazon.com/images/S/aplus-media-library-service-media/293591db-9d83-4e73-bb39-9743ea7864f6.__CR0,600,2000,2000_PT0_SX300_V1___.jpg,https://images-na.ssl-images-amazon.com/images/G/01/x-locale/common/grey-pixel.gif,https://m.media-amazon.com/images/S/aplus-media-library-service-media/9559e086-392e-4fc2-8be3-4c0e13a87952.__CR0,551,2400,2400_PT0_SX300_V1___.jpg,https://images-na.ssl-images-amazon.com/images/G/01/x-locale/common/grey-pixel.gif,https://m.media-amazon.com/images/S/aplus-media-library-service-media/d8b367f9-b44f-42c1-8f52-5a50c9647afc.__CR92,0,1015,628_PT0_SX970_V1___.png,https://images-na.ssl-images-amazon.com/images/G/01/x-locale/common/grey-pixel.gif,https://m.media-amazon.com/images/S/aplus-media-library-service-media/a39a219d-f8de-4e2f-8780-6a0da4136457.__CR0,0,970,300_PT0_SX970_V1___.jpg,https://m.media-amazon.com/images/S/aplus-media-library-service-media/e228986f-4e4c-4834-b8cc-8982378f980a.__CR0,0,1500,3000_PT0_SX150_V1___.jpg,https://m.media-amazon.com/images/S/aplus-media-library-service-media/06a945c0-a80f-4ccb-8786-3d0308c216e4.__CR0,0,640,1280_PT0_SX150_V1___.jpeg,https://m.media-amazon.com/images/S/aplus-media-library-service-media/293591db-9d83-4e73-bb39-9743ea7864f6.__CR250,0,1500,3000_PT0_SX150_V1___.jpg,https://m.media-amazon.com/images/S/aplus-media-library-service-media/59003d75-f736-4e4e-83c3-b351328e6ec2.__CR211,0,540,1080_PT0_SX150_V1___.png,https://m.media-amazon.com/images/S/aplus-media-library-service-media/08840dd3-f0f4-41a9-8945-7263f568a518.__CR0,0,640,1280_PT0_SX150_V1___.jpeg,https://m.media-amazon.com/images/S/aplus-media-library-service-brand-media/9468c3a6ca8357bfec379ccf1d226b71.w2000.h3000.__CR250,0,1500,3000_PT0_SX150_V1___.jpg","Mush Bath Towels are made from selected Bamboo Fibers which makes them Ultra Soft, Super Absorbent & Quick Dry. Mush Towels are known for their softness and the ability to absorb 3X more water as compared to regular cotton towels. The Bath Towels are made with a thick 600 GSM fabric and have a dimension of 75 by 150 cms which makes them ideal for pool, beach, gym, sports, yoga, salon & spa.Mush towels are designed with ultra-soft bamboo fibers that is suitable for sensitive  skin. Mush Towel retains softness even after multiple washes.The Bamboo Fabric is more absorbent & breathable than any other fabric due to a wider cross section. This allows it to absorb 3x times more water while preventing dampen odor common in other cotton towels.These towels can be used as a bath towel, beach towel, pool towel, yoga towel, gym towel, spa towel etc. Add a touch of elegance to your bathroom with these premium towels. For every occasion our bath towel set makes a perfect gift for your family and friends!",,,," Towel Set with 3 pieces- Large Bath Towel (75*150cms), Hand Towel (35*75) and Face Towel (35*35 cms) ; 100% Bamboo Terry ; Long lasting fade resistant fabric  , Beautifully Packed: Your Towel set comes carefully packed in an eco-friendly fabric bag, all ready for gracious house warming gifting  , Eco Friendly & Clean: Bamboo is an organic plant and these towels are totally green, odor and allergy resistant, producing less lint making them a clean, environment friendly and sustainable resource.  ",,,,,,18%,"https://m.media-amazon.com/images/I/51u3UbC8nZL.jpg,https://m.media-amazon.com/images/I/61E40e1-+JL.jpg,https://m.media-amazon.com/images/I/512NjV38NkL.jpg,https://m.media-amazon.com/images/I/41MVtiUA7eL.jpg,https://m.media-amazon.com/images/I/41lqeYMD6AL.jpg,https://m.media-amazon.com/images/I/51CiCE+zVfS.jpg,https://m.media-amazon.com/images/I/51tbp3icgzS.jpg",*Images for representative purpose only,,,,,,,,,,,,,"Avail No Cost EMI on select cards for orders above ₹3000,Upto ₹134.92 discount on select Credit Cards,Get GST  invoice and save up to 28% on business purchases.",,,"1,799",Back to results,4.3,382 global ratings,,,"Mush Bamboo 1 Bath Towel, 1 Hand Towel, 1 Face Towel 600 GSM (Set of 3, Khaki)"," No Cost EMI , Bank Offer , Partner Offers ",https://www.amazon.in/dp/B07CW1BJQY,,,
B0BPF1TW2L,"1,998","https://images-na.ssl-images-amazon.com/images/G/01/x-locale/common/grey-pixel.gif,https://m.media-amazon.com/images/S/aplus-media-library-service-media/ebe78dc0-e5a1-4f74-a156-b27268bde75d.__CR0,0,600,180_PT0_SX600_V1___.jpg,https://images-na.ssl-images-amazon.com/images/G/01/x-locale/common/grey-pixel.gif,https://m.media-amazon.com/images/S/aplus-media-library-service-media/c832e64d-788a-4015-8f0d-5ef4ea84aa35.__CR0,510,1500,464_PT0_SX970_V1___.jpg,https://images-na.ssl-images-amazon.com/images/G/01/x-locale/common/grey-pixel.gif,https://m.media-amazon.com/images/S/aplus-media-library-service-media/9e688445-6894-4b7c-a0e2-434875c84817.__CR0,0,500,500_PT0_SX220_V1___.png,https://images-na.ssl-images-amazon.com/images/G/01/x-locale/common/grey-pixel.gif,https://m.media-amazon.com/images/S/aplus-media-library-service-media/7541ca6e-4fa9-4b85-9018-1c5366a50cfa.__CR200,0,880,880_PT0_SX220_V1___.jpg,https://images-na.ssl-images-amazon.com/images/G/01/x-locale/common/grey-pixel.gif,https://m.media-amazon.com/images/S/aplus-media-library-service-media/7788f86e-1da5-4a64-a23c-07f1d31f2d0e.__CR0,0,500,500_PT0_SX220_V1___.png,https://images-na.ssl-images-amazon.com/images/G/01/x-locale/common/grey-pixel.gif,https://m.media-amazon.com/images/S/aplus-media-library-service-media/bfe27c9e-dd83-4716-8af8-e324de6d6fa4.__CR0,108,1000,1000_PT0_SX220_V1___.jpg,https://images-na.ssl-images-amazon.com/images/G/01/x-locale/common/grey-pixel.gif,https://m.media-amazon.com/images/S/aplus-media-library-service-media/141e3e44-cf22-4368-b5a7-f2fe07d3f944.__CR0,206,1080,668_PT0_SX970_V1___.png,https://images-na.ssl-images-amazon.com/images/G/01/x-locale/common/grey-pixel.gif,https://m.media-amazon.com/images/S/aplus-media-library-service-media/93339dee-b253-4611-9474-4339ef9ba34c.__CR230,0,620,620_PT0_SX135_V1___.png,https://images-na.ssl-images-amazon.com/images/G/01/x-locale/common/grey-pixel.gif,https://m.media-amazon.com/images/S/aplus-media-library-service-media/4da51b57-5c42-4585-945c-60aaed3924b7.__CR456,0,3888,3888_PT0_SX135_V1___.jpg,https://images-na.ssl-images-amazon.com/images/G/01/x-locale/common/grey-pixel.gif,https://m.media-amazon.com/images/S/aplus-media-library-service-media/5e872cd9-a18f-4b5d-8c86-092f1320b876.__CR72,0,4016,4016_PT0_SX135_V1___.jpg,https://images-na.ssl-images-amazon.com/images/G/01/x-locale/common/grey-pixel.gif,https://m.media-amazon.com/images/S/aplus-media-library-service-media/749bbdcb-017f-4ca6-bb23-5d0723e22381.__CR0,251,999,999_PT0_SX135_V1___.jpg,https://images-na.ssl-images-amazon.com/images/G/01/x-locale/common/grey-pixel.gif,https://m.media-amazon.com/images/S/aplus-media-library-service-media/a39a219d-f8de-4e2f-8780-6a0da4136457.__CR0,0,970,300_PT0_SX970_V1___.jpg,https://m.media-amazon.com/images/S/aplus-media-library-service-media/59003d75-f736-4e4e-83c3-b351328e6ec2.__CR196,0,540,1080_PT0_SX150_V1___.png,https://m.media-amazon.com/images/S/aplus-media-library-service-media/8da3bfee-f22a-4a0d-bd4c-d93276e7cdcc.__CR0,0,640,1280_PT0_SX150_V1___.jpeg,https://m.media-amazon.com/images/S/aplus-media-library-service-media/293591db-9d83-4e73-bb39-9743ea7864f6.__CR127,0,1500,3000_PT0_SX150_V1___.jpg,https://m.media-amazon.com/images/S/aplus-media-library-service-media/d8e17f6a-877f-4230-9639-d65d142272f2.__CR625,0,1250,2500_PT0_SX150_V1___.jpg,https://m.media-amazon.com/images/S/aplus-media-library-service-media/08840dd3-f0f4-41a9-8945-7263f568a518.__CR0,0,640,1280_PT0_SX150_V1___.jpeg,https://m.media-amazon.com/images/S/aplus-media-library-service-brand-media/9468c3a6ca8357bfec379ccf1d226b71.w2000.h3000.__CR250,0,1500,3000_PT0_SX150_V1___.jpg","Mush Turkish Towels are made from selected bamboo fibers which makes them ultra soft, super absorbent & quick dry. Turkish towels can be used as beach towel, bath towel, pool towel, yoga towel etcFace Towels are sized : 14"" X 14"" inches(Pocket friendly – Square shaped)Our Face towels are exquisitely made to be thicker than usual cotton towels which enables it to work up a good lather during bath time, the face/wash towel can even be used to clean serious mess like sweat, dust & make-up.Hand Towels are the generously length measuring 14""x29"" inchesIdeal for Nail/Hair Salons, Gyms, Businesses & Households. Our Hand Towels blends luxury design with functional fabric that last for long duration. They are odor free as bamboo fabric allows it to breathe which prevents stinky towel smells common in other gym towels.Bath Towels are sized: 59"" X 29"" inchesMush bathroom towels are extremely delicate in touch while absorbing all traces of moisture efficiently from body skin. Our towel set comes in an array of beautiful colors and patterns to enhance home decor.Give your hard working feet the comfort it deserves with Mush Performance Bamboo socks with built in Terry Cushion for extra comfort and with mesh design for ventilation. The bamboo Fabric provides a thermo regulating cover to your feet thereby reducing sweat.Available colours- Grey, White, Black and Navy Blue.",,,," Material: 100% Bamboo ; Size: 75 X 160 cms ; Weight: 265 Grams  , Bamboo Fabric : Mush travel towel is made of fine Bamboo fibers which makes it super soft, 3 x more absorbant than cotton, smooth and compact, skin friendly, and naturally anti-odor.   , Multipurpose: Mush quick dry Bamboo towel can be used as a sports towel, travel towel, yoga towel or as a mat for beach, bath, pool, swimming, water, mountaineering, fitness, camping, hiking, picnic, etc. The camping towel can also be as sun shade or cape to protect your skin against the sun  , Travel / Gift Ready - The towel comes packed in a reusable eco friendly fabric bag which makes it easy to carry on the go. A perfect gift for any traveler / hiker  , Anti-Odor - Our Towels won't smell even if it is left damp for multiple days or is not washed often. It is because Bamboo is naturally anti-microbial which avoids accumulation of odor causing microbes on the towel  , Washcare: Machine Washable. Do not bleach  ",,,,,,30%,"https://m.media-amazon.com/images/I/41Ts9uTPZUL.jpg,https://m.media-amazon.com/images/I/41m0W7MyCYL.jpg,https://m.media-amazon.com/images/I/51MuLeOLiBL.jpg,https://m.media-amazon.com/images/I/31j9IF55TJL.jpg,https://m.media-amazon.com/images/I/41kEFb4MMuL.jpg,https://m.media-amazon.com/images/I/41zABBiJ8uL.jpg,https://m.media-amazon.com/images/I/512BXCCeA+L.jpg",,,,,,,,,,,,,,"Avail No Cost EMI on select cards for orders above ₹3000,Upto ₹104.92 discount on select Credit Cards,Get GST  invoice and save up to 28% on business purchases.",,,"1,399",Back to results,,,,,"Mush 100% Bamboo Light Weight & Ultra-Compact Turkish Towel Super Soft, Absorbent, Quick Dry, Anti-Odor Bamboo Towel for Bath, Travel, Gym, Swim and Workout (2, Lavender - Dark Green)"," No Cost EMI , Bank Offer , Partner Offers ",https://www.amazon.in/dp/B0BPF1TW2L,,,
B0BRKVGC61,"1,798","https://images-na.ssl-images-amazon.com/images/G/01/x-locale/common/grey-pixel.gif,https://m.media-amazon.com/images/S/aplus-media-library-service-media/3b07b53c-2704-43a7-acd2-62490c9a8b01.__CR0,0,970,600_PT0_SX970_V1___.png,https://images-na.ssl-images-amazon.com/images/G/01/x-locale/common/grey-pixel.gif,https://m.media-amazon.com/images/S/aplus-media-library-service-media/bcfaf91d-8759-4de9-8be8-c7e7a1488fd9.__CR0,0,970,600_PT0_SX970_V1___.png,https://images-na.ssl-images-amazon.com/images/G/01/x-locale/common/grey-pixel.gif,https://m.media-amazon.com/images/S/aplus-media-library-service-media/65a602e9-1453-4268-bd14-1e5fbf1062c3.__CR0,0,970,600_PT0_SX970_V1___.png,https://images-na.ssl-images-amazon.com/images/G/01/x-locale/common/grey-pixel.gif,https://m.media-amazon.com/images/S/aplus-media-library-service-media/21176b26-cc9a-4986-aef8-6637a5aa1d4b.__CR0,0,970,600_PT0_SX970_V1___.png,https://images-na.ssl-images-amazon.com/images/G/01/x-locale/common/grey-pixel.gif,https://m.media-amazon.com/images/S/aplus-media-library-service-media/8558e2ca-a77c-4d96-946c-ccb05be9e389.__CR0,0,970,600_PT0_SX970_V1___.png,https://images-na.ssl-images-amazon.com/images/G/01/x-locale/common/grey-pixel.gif,https://m.media-amazon.com/images/S/aplus-media-library-service-media/69cacb1d-7bf4-4daa-8d1a-a682db4c6e8a.__CR0,0,970,600_PT0_SX970_V1___.png",,,,," COMFORTABLE : When babies are swaddled, they sleep better & feel safe as babies are used to being wrapped tightly in the womb. Bamboo Fabric is weightless & thermo-regulating which helps to regulate the body temperature based on the weather.  , SOFTER THAN SOFT : The bamboo fabric is super-soft and gentle on your baby’s skin. The soft plush fabric wraps around your baby for a comfortable sleep. It is also the best choice for rash prevention.  , MULTIPURPOSE : Mush Bamboo Swaddles can be used as a play mat, a blanket, a burp cloth, a nursing cover, a picnic blanket. It is one of the best baby shower gifts for every new mom.  ",,,,,,50%,"https://m.media-amazon.com/images/I/41rN-WyQ5hL.jpg,https://m.media-amazon.com/images/I/41cqOeR8c2L.jpg,https://m.media-amazon.com/images/I/41PX6aSEW4L.jpg,https://m.media-amazon.com/images/I/51mfbyJtNCL.jpg,https://m.media-amazon.com/images/I/414epNM9msL.jpg,https://m.media-amazon.com/images/I/41becUZJ0qL.jpg,https://m.media-amazon.com/images/I/41BVVZxRwiL.jpg",,,,,,,,,,,,,,"Avail No Cost EMI on select cards for orders above ₹3000,Upto ₹67.42 discount on select Credit Cards,Get GST  invoice and save up to 28% on business purchases.",,,899,Back to results,4.6,35 global ratings,,,"Mush 100% Bamboo Swaddle : Ultra Soft, Breathable, Thermoregulating, Absorbent, Light Weight and Multipurpose Bamboo Wrapper / Baby Bath Towel / Blanket (2, Jungle Grey - Geo Peach)"," No Cost EMI , Bank Offer , Partner Offers ",https://www.amazon.in/dp/B0BRKVGC61,,,
B0B2WVWJFM,359,,,,,," Highly Absorbent & Quick Dry : Its tight under-weave supports the strength of the fabric, making them durable. Designed with upgraded honeycomb structure, making them lightweight, super absorbent and dry quickly, perfect to tackle all of your dryings and wiping tasks without leaving streaks or scratches.  , User Friendly-Fit in your Hand : At 18 x 23 cms, our cleaning towel fits comfortably in your hand without folding or wadding up when it's time to do the dishes, clean appliances, or wipe down the counters. They are a great size for storage around the sink or on a dining table for decoration.  , Multipurpose : Mush Kitchen Towels helps to remove dust, dirt, stain, grease, fingerprints. They are highly suitable for cleaning home furniture, car windows, kitchen tops, dining tables, office tables, glass windows, electric appliances, etc.  , Hanging Loop Design: A Hanging loop allows for easy hanging of the towel near the washbasin, dining area, kitchen cabinets, etc.  ",,,,,"Mush Kitchen Towels are made from selected Bamboo Fibers which makes them Durable, Super Absorbent & Quick Dry. So you can easily clean the mess and dust particles off the kitchen top & home furniture. Mush Kitchen Towels retain dryness easily after every wash and have a dimension of 18 by 23 cms which makes them ideal for doing dishes, cleaning appliances, or wiping down the counters. Available in 5 bright solid colours: Yellow, Light Green, Sky Blue, Baby Pink & Violet",17%,"https://m.media-amazon.com/images/I/517Xj5u7b1L.jpg,https://m.media-amazon.com/images/I/519p8sMjapL.jpg,https://m.media-amazon.com/images/I/41SS31+3hTL.jpg,https://m.media-amazon.com/images/I/61AMTFS53xL.jpg,https://m.media-amazon.com/images/I/51-SSBkPTcL.jpg",,,,,,,,,,,,,,"Avail No Cost EMI on select cards for orders above ₹3000,Upto ₹22.42 discount on select Credit Cards,Get GST  invoice and save up to 28% on business purchases.",,,299,Back to results,3.7,85 global ratings,,,"Mush Bamboo Super Absorbent, Anti Odor, Lint and Streak Free Reusable Cleaning Towel- Multipurpose Wash Cloth for Kitchen, Car, Windows, Glass, Utensils, Furniture."," No Cost EMI , Bank Offer , Partner Offers ",https://www.amazon.in/dp/B0B2WVWJFM,,,
B09X48F423,"1,798","https://images-na.ssl-images-amazon.com/images/G/01/x-locale/common/grey-pixel.gif,https://m.media-amazon.com/images/S/aplus-media-library-service-media/3b07b53c-2704-43a7-acd2-62490c9a8b01.__CR0,0,970,600_PT0_SX970_V1___.png,https://images-na.ssl-images-amazon.com/images/G/01/x-locale/common/grey-pixel.gif,https://m.media-amazon.com/images/S/aplus-media-library-service-media/bcfaf91d-8759-4de9-8be8-c7e7a1488fd9.__CR0,0,970,600_PT0_SX970_V1___.png,https://images-na.ssl-images-amazon.com/images/G/01/x-locale/common/grey-pixel.gif,https://m.media-amazon.com/images/S/aplus-media-library-service-media/65a602e9-1453-4268-bd14-1e5fbf1062c3.__CR0,0,970,600_PT0_SX970_V1___.png,https://images-na.ssl-images-amazon.com/images/G/01/x-locale/common/grey-pixel.gif,https://m.media-amazon.com/images/S/aplus-media-library-service-media/21176b26-cc9a-4986-aef8-6637a5aa1d4b.__CR0,0,970,600_PT0_SX970_V1___.png,https://images-na.ssl-images-amazon.com/images/G/01/x-locale/common/grey-pixel.gif,https://m.media-amazon.com/images/S/aplus-media-library-service-media/8558e2ca-a77c-4d96-946c-ccb05be9e389.__CR0,0,970,600_PT0_SX970_V1___.png,https://images-na.ssl-images-amazon.com/images/G/01/x-locale/common/grey-pixel.gif,https://m.media-amazon.com/images/S/aplus-media-library-service-media/69cacb1d-7bf4-4daa-8d1a-a682db4c6e8a.__CR0,0,970,600_PT0_SX970_V1___.png",,,,," COMFORTABLE : When babies are swaddled, they sleep better & feel safe as babies are used to being wrapped tightly in the womb. Bamboo Fabric is weightless & thermo-regulating which helps to regulate the body temperature based on the weather.  , SOFTER THAN SOFT : The bamboo fabric is super-soft and gentle on your baby’s skin. The soft plush fabric wraps around your baby for a comfortable sleep. It is also the best choice for rash prevention.  , MULTIPURPOSE : Mush Bamboo Swaddles can be used as a play mat, a blanket, a burp cloth, a nursing cover, a picnic blanket. It is one of the best baby shower gifts for every new mom.  ",,,,,,50%,"https://m.media-amazon.com/images/I/41TQdlYwB3L.jpg,https://m.media-amazon.com/images/I/51pApkFhhTL.jpg,https://m.media-amazon.com/images/I/51j3rcQM89L.jpg,https://m.media-amazon.com/images/I/51hEMPKkv5L.jpg,https://m.media-amazon.com/images/I/41Xmg5EEufL.jpg,https://m.media-amazon.com/images/I/41cayfqtpSL.jpg,https://m.media-amazon.com/images/I/41gCzb8YsoL.jpg",,,,,,,,,,,,,,"Avail No Cost EMI on select cards for orders above ₹3000,Upto ₹67.42 discount on select Credit Cards,Get GST  invoice and save up to 28% on business purchases.",,,899,Back to results,4.6,35 global ratings,,,"Mush 100% Bamboo Swaddle: Ultra Soft, Breathable, Thermoregulating, Absorbent, Light Weight and Multipurpose Bamboo Wrapper / Baby Bath Towel / Blanket(2, Golden Leaf & Grey Leaf)"," No Cost EMI , Bank Offer , Partner Offers ",https://www.amazon.in/dp/B09X48F423,,,
B09X48CMKB,"1,798","https://images-na.ssl-images-amazon.com/images/G/01/x-locale/common/grey-pixel.gif,https://m.media-amazon.com/images/S/aplus-media-library-service-media/3b07b53c-2704-43a7-acd2-62490c9a8b01.__CR0,0,970,600_PT0_SX970_V1___.png,https://images-na.ssl-images-amazon.com/images/G/01/x-locale/common/grey-pixel.gif,https://m.media-amazon.com/images/S/aplus-media-library-service-media/bcfaf91d-8759-4de9-8be8-c7e7a1488fd9.__CR0,0,970,600_PT0_SX970_V1___.png,https://images-na.ssl-images-amazon.com/images/G/01/x-locale/common/grey-pixel.gif,https://m.media-amazon.com/images/S/aplus-media-library-service-media/65a602e9-1453-4268-bd14-1e5fbf1062c3.__CR0,0,970,600_PT0_SX970_V1___.png,https://images-na.ssl-images-amazon.com/images/G/01/x-locale/common/grey-pixel.gif,https://m.media-amazon.com/images/S/aplus-media-library-service-media/21176b26-cc9a-4986-aef8-6637a5aa1d4b.__CR0,0,970,600_PT0_SX970_V1___.png,https://images-na.ssl-images-amazon.com/images/G/01/x-locale/common/grey-pixel.gif,https://m.media-amazon.com/images/S/aplus-media-library-service-media/8558e2ca-a77c-4d96-946c-ccb05be9e389.__CR0,0,970,600_PT0_SX970_V1___.png,https://images-na.ssl-images-amazon.com/images/G/01/x-locale/common/grey-pixel.gif,https://m.media-amazon.com/images/S/aplus-media-library-service-media/69cacb1d-7bf4-4daa-8d1a-a682db4c6e8a.__CR0,0,970,600_PT0_SX970_V1___.png",,,,," COMFORTABLE : When babies are swaddled, they sleep better & feel safe as babies are used to being wrapped tightly in the womb. Bamboo Fabric is weightless & thermo-regulating which helps to regulate the body temperature based on the weather.  , SOFTER THAN SOFT : The bamboo fabric is super-soft and gentle on your baby’s skin. The soft plush fabric wraps around your baby for a comfortable sleep. It is also the best choice for rash prevention.  , MULTIPURPOSE : Mush Bamboo Swaddles can be used as a play mat, a blanket, a burp cloth, a nursing cover, a picnic blanket. It is one of the best baby shower gifts for every new mom.  ",,,,,,50%,"https://m.media-amazon.com/images/I/31r0-YkM5YL.jpg,https://m.media-amazon.com/images/I/51pApkFhhTL.jpg,https://m.media-amazon.com/images/I/41qi3ACsgeL.jpg,https://m.media-amazon.com/images/I/51hEMPKkv5L.jpg,https://m.media-amazon.com/images/I/31YrmQAgbWL.jpg,https://m.media-amazon.com/images/I/31x9oJR18vL.jpg,https://m.media-amazon.com/images/I/41gCzb8YsoL.jpg",,,,,,,,,,,,,,"Avail No Cost EMI on select cards for orders above ₹3000,Upto ₹67.42 discount on select Credit Cards,Get GST  invoice and save up to 28% on business purchases.",,,899,Back to results,4.6,35 global ratings,,,"Mush Ultra Soft, Comfortable & Multipurpose 100% Bamboo Baby Swaddle & Wrapper (2, Jungle (Grey) & Sea (Grey))"," No Cost EMI , Bank Offer , Partner Offers ",https://www.amazon.in/dp/B09X48CMKB,,,
