ASIN,MRP,aplus_images,aplus_text,attributes,best_sellers_rank,brand,bullets,collection,country_of_origin,date_first_available,department,description,discount,image_links,important_info,importer,is_discontinued_by_manufacturer,item_height,item_height_unit,item_length,item_length_unit,item_width,item_width_unit,material,metal,model_number,net_quantity,offers,packaging,packer,price,product_path,ratings,ratings_count,special_offers,stone,title,type_of_offers,url,video_links,warranty_type,weight
B0B51TRRSB,"1,499",,,,,,,,,,,,47%,"https://m.media-amazon.com/images/I/31e4Vy7sfML.jpg,https://m.media-amazon.com/images/I/31qtiGjvuHL.jpg",,,,,,,,,,,,,,"Avail No Cost EMI on select cards for orders above ₹3000,Upto ₹59.85 discount on select Credit Cards,Get GST  invoice and save up to 28% on business purchases.",,,798,Back to results,,,,,"Mush Ultra-Soft & Super-Absorbent Baby Hooded Towel (1, White)"," No Cost EMI , Bank Offer , Partner Offers ",https://www.amazon.in/dp/B0B51TRRSB,,,
B0BF4ZRKF1,"1,499",,,,,," Mittens, also known as hand covers, are designed to cover a newborn's hands to prevent their nails from scratching their sensitive skin.  , These pairs of Socks are soft and made from softest fabric which keep the baby's feet warm and dry.  ,  The head-caps are really cute and keeps the baby warm and helps the baby to beat the Cold.  ,  Cute and Colorful baby Mittens,Socks & Caps which can be used by both boys and girls. Comes with a cute bag which makes it easy to carry them around  , The package contains 6 pieces- 2 socks, 2 caps and 2 mittens in cute designs for babies in the age group of 0-3, 3-6 & 6-12 months.  ",,,,,"Mush brings you babywear designed in sustainable bamboo fabric, for a plush texture that’s as soft as a snuggle . Mush Kids Products are made from very fine bamboo material and a perfect set for your newborn baby. Make your baby comfortable with sustainable and ultra soft bamboo fabric crafted to offer a comfortable fit for your rapidly growing mini-me. The bamboo fabric is extremely  gentle on your baby’s skin and hence it is also the best choice for rash prevention. Designed for convenience, Mush baby clothing is easy to pull on & easier to wiggle off.",47%,"https://m.media-amazon.com/images/I/41R1OsV3JKL.jpg,https://m.media-amazon.com/images/I/41N6YsP+HzL.jpg,https://m.media-amazon.com/images/I/31qyLHn-VFL.jpg,https://m.media-amazon.com/images/I/51R0+9Jq3SL.jpg,https://m.media-amazon.com/images/I/315kACHR2mL.jpg,https://m.media-amazon.com/images/I/31BJgHBuByL.jpg,https://m.media-amazon.com/images/I/31w4h3Kfn0L.jpg",,,,,,,,,,,,,,"Upto ₹39.95 discount on HSBC Bank Credit Cards,Get GST  invoice and save up to 28% on business purchases.",,,799,Back to results,,,,,"Mush Ultra Soft Bamboo Unisex Mittens, Socks & Caps Combo Set for New Born Baby/Kids (Pack of 6, (3-6 Month, Stary Night & Daylight)"," Bank Offer , Partner Offers ",https://www.amazon.in/dp/B0BF4ZRKF1,,,
B09XQX4KJW,999,"https://images-na.ssl-images-amazon.com/images/G/01/x-locale/common/grey-pixel.gif,https://m.media-amazon.com/images/S/aplus-media-library-service-media/01fee8f3-75ec-424d-bb80-cd609419a497.__CR0,477,2500,1546_PT0_SX970_V1___.jpg,https://images-na.ssl-images-amazon.com/images/G/01/x-locale/common/grey-pixel.gif,https://m.media-amazon.com/images/S/aplus-media-library-service-media/1d84ded7-1cca-4925-841b-8d1cd6b597c8.__CR0,0,2500,2500_PT0_SX300_V1___.jpg,https://images-na.ssl-images-amazon.com/images/G/01/x-locale/common/grey-pixel.gif,https://m.media-amazon.com/images/S/aplus-media-library-service-media/2c4864b0-1fd2-4f22-9df5-b3e02a9d19b4.__CR0,0,2500,2500_PT0_SX300_V1___.jpg,https://images-na.ssl-images-amazon.com/images/G/01/x-locale/common/grey-pixel.gif,https://m.media-amazon.com/images/S/aplus-media-library-service-media/a0b3129c-584e-42b5-a4a3-5d6ed158529a.__CR0,0,2500,2500_PT0_SX300_V1___.jpg,https://m.media-amazon.com/images/S/aplus-media-library-service-media/9b87daef-323b-4628-ad15-38c4195041f8.__CR0,0,1250,2500_PT0_SX150_V1___.jpg,https://m.media-amazon.com/images/S/aplus-media-library-service-media/1d84ded7-1cca-4925-841b-8d1cd6b597c8.__CR0,0,1250,2500_PT0_SX150_V1___.jpg,https://m.media-amazon.com/images/S/aplus-media-library-service-media/aea7d410-da07-4326-8dc7-a9d61e77ccaa.__CR1250,0,1250,2500_PT0_SX150_V1___.jpg,https://m.media-amazon.com/images/S/aplus-media-library-service-media/14c39aaa-9187-4709-b170-dc405fa3acd0.__CR1458,417,1042,2083_PT0_SX150_V1___.jpg,https://images-na.ssl-images-amazon.com/images/G/01/x-locale/common/grey-pixel.gif,https://m.media-amazon.com/images/S/aplus-media-library-service-media/bd8ebbb9-520c-406c-827d-21e2f3724568.__CR0,0,2500,2500_PT0_SX300_V1___.jpg,https://images-na.ssl-images-amazon.com/images/G/01/x-locale/common/grey-pixel.gif,https://m.media-amazon.com/images/S/aplus-media-library-service-media/7d6c78eb-7713-4bec-82e6-5c999c6b7da6.__CR0,0,2500,2500_PT0_SX300_V1___.jpg,https://images-na.ssl-images-amazon.com/images/G/01/x-locale/common/grey-pixel.gif,https://m.media-amazon.com/images/S/aplus-media-library-service-media/c84c15a2-f534-4f25-a74e-756614681561.__CR0,0,2500,2500_PT0_SX300_V1___.jpg","Mush Hand Towels are made from selected Bamboo Fibers which makes them Ultra Soft, Super Absorbent & Quick Dry. Mush Towels are known for their softness and the ability to absorb 3X more water as compared to regular cotton towels. The Hand Towels are made with a thick 450 GSM fabric and have a dimension of 35 by 75 cms which makes them ideal for gym, sports, yoga, salon & spa.Mush towels are designed with ultra-soft bamboo fibers that is suitable for sensitive  skin. Mush Towel retains softness even after multiple washes.The Bamboo Fabric is more absorbent & breathable than any other fabric due to a wider cross section. This allows it to absorb 3x times more water while preventing dampen odor common in other cotton towels.These towels can be used as a pool towel, yoga towel, gym towel, spa etc. Add a touch of elegance to your bathroom with these premium towels. For every occasion our hand towel set makes a perfect gift for your family and friends! Mush towel set comes in an array of beautiful colors & patterns: Emerald Blue, Pearl White, Ruby Red & Royal Beige",,,," Super Absorbent: Mush Designer towels are made with 100% Bamboo, the naturally plush fibers ensure comfort, longevity, and absorbency. They are odor free as bamboo fabric allows it to breathe which prevents stinky towel smells common in other cotton towels.  , Multipurpose: Mush Designer Bath towels can be used as beach towel, bath towel, pool towel, yoga towel as well as gym towel. Add a touch of elegance to the bathroom with these premium designer towels.  , Mush towels are beautifully arranged in sets, making it the perfect premium gift for your family and friends! Mush towelset comes in an array of beautiful colors & patterns: Emerald Blue, Pearl White, Ruby Red & Royal Beige  ",,,,,,30%,"https://m.media-amazon.com/images/I/511cCmlf8sL.jpg,https://m.media-amazon.com/images/I/51SjP3oMKpL.jpg,https://m.media-amazon.com/images/I/51Z9L3GsjSL.jpg,https://m.media-amazon.com/images/I/51tnvO082wL.jpg,https://m.media-amazon.com/images/I/51t7JH85PFL.jpg,https://m.media-amazon.com/images/I/51ucJkR8VIL.jpg,https://m.media-amazon.com/images/I/51Bjx439ltL.jpg",,,,,,,,,,,,,,"Avail No Cost EMI on select cards for orders above ₹3000,Upto ₹52.42 discount on select Credit Cards,Get GST  invoice and save up to 28% on business purchases.",,,699,Back to results,3.9,99 global ratings,,,"Mush Designer Bamboo Hand Towels |Ultra Soft, Absorbent & Quick Dry Towels for Bath, Spa and Yoga (Emerald Blue, Hand Towelset of 2) 450 GSM"," No Cost EMI , Bank Offer , Partner Offers ",https://www.amazon.in/dp/B09XQX4KJW,,,
B0BNNKFCBZ,999,"https://images-na.ssl-images-amazon.com/images/G/01/x-locale/common/grey-pixel.gif,https://m.media-amazon.com/images/S/aplus-media/sc/428c7aa8-812a-4580-badf-4c4eb47d4335.__CR0,0,600,180_PT0_SX600_V1___.jpg,https://images-na.ssl-images-amazon.com/images/G/01/x-locale/common/grey-pixel.gif,https://m.media-amazon.com/images/S/aplus-media-library-service-media/c49a1903-891c-4a77-acc2-2f09f0666958.__CR0,1196,4107,1270_PT0_SX970_V1___.jpg,https://images-na.ssl-images-amazon.com/images/G/01/x-locale/common/grey-pixel.gif,https://m.media-amazon.com/images/S/aplus-media-library-service-media/7017469a-5418-4fd1-af6f-decc0e0a2482.__CR356,0,3775,3775_PT0_SX220_V1___.jpg,https://images-na.ssl-images-amazon.com/images/G/01/x-locale/common/grey-pixel.gif,https://m.media-amazon.com/images/S/aplus-media-library-service-media/93339dee-b253-4611-9474-4339ef9ba34c.__CR263,56,564,564_PT0_SX220_V1___.png,https://images-na.ssl-images-amazon.com/images/G/01/x-locale/common/grey-pixel.gif,https://m.media-amazon.com/images/S/aplus-media-library-service-media/fb9fe961-7d28-427e-9288-8e2b563f0ea3.__CR448,0,3762,3762_PT0_SX220_V1___.jpg,https://images-na.ssl-images-amazon.com/images/G/01/x-locale/common/grey-pixel.gif,https://m.media-amazon.com/images/S/aplus-media-library-service-media/37e15195-56d2-47d5-b68d-afc6a9c1a76a.__CR80,130,1003,1003_PT0_SX220_V1___.jpg,https://images-na.ssl-images-amazon.com/images/G/01/x-locale/common/grey-pixel.gif,https://m.media-amazon.com/images/S/aplus-media-library-service-media/f48617fd-bbda-4c53-a0de-12ba37ee8031.__CR87,0,1746,1080_PT0_SX970_V1___.png,https://images-na.ssl-images-amazon.com/images/G/01/x-locale/common/grey-pixel.gif,https://m.media-amazon.com/images/S/aplus-media/sc/7c58bdf3-2d71-4fba-8e81-0220b84ecca7.__CR0,0,1500,1500_PT0_SX135_V1___.jpg,https://images-na.ssl-images-amazon.com/images/G/01/x-locale/common/grey-pixel.gif,https://m.media-amazon.com/images/S/aplus-media-library-service-media/04b27d8e-e731-4216-bacc-1ce928475e38.__CR85,0,330,330_PT0_SX135_V1___.jpg,https://images-na.ssl-images-amazon.com/images/G/01/x-locale/common/grey-pixel.gif,https://m.media-amazon.com/images/S/aplus-media/sc/a901b1a3-22d1-4ceb-9ed7-bc31a4f3e55b.__CR407,335,3347,3347_PT0_SX135_V1___.jpg,https://images-na.ssl-images-amazon.com/images/G/01/x-locale/common/grey-pixel.gif,https://m.media-amazon.com/images/S/aplus-media-library-service-media/2f518dda-8f2f-42c3-945f-0b2276e00b41.__CR0,0,1500,1500_PT0_SX135_V1___.jpg","Mush face towels are made of 100% bamboo fibers which makes them ultra soft, highly absorbent and quick dry. Mush Face towels are great for your daily use for face cleaning, spa, yoga, gym etc.Mush face towels come with most of the colors in beautifully arranged sets, making it the perfect premium gift especially for birthdays, festivals & wedding favors.Turkish Towels are sized : 29.5"" X 59""inches (Easy to fold)Mush Turkish towels helps you to wrap yourself in freshness every day, every time. You can use Mush Turkish towel as a scarf on the outside, as a shawl on the terminal & as a travel blanket on an airplane. They are gentle enough and skin sensitive to carry babies and toddlers.Mush Towel blends luxury design with functional fabric that last for long duration. Mush Towels are made from selected Bamboo Fibres which makes them ultra soft silky and super absorbent.Hand Towels are the generously length measuring 14""x29"" inchesIdeal for Nail/Hair Salons, Gyms, Businesses & Households. Our Hand Towels blends luxury design with functional fabric that last for long duration. They are odor free as bamboo fabric allows it to breathe which prevents stinky towel smells common in other gym towels.Give your hard working feet the comfort it deserves with Mush Performance Bamboo socks with built in Terry Cushion for extra comfort and with mesh design for ventilation. The bamboo Fabric provides a thermo regulating cover to your feet thereby reducing sweat.Available colours- Grey, White, Black and Navy Blue.",,,," Pack of 5 pcs ; Size - 35 * 35 cms square towels ; Made from 100% Bamboo Terry  , Spa-Like Softness: Made of 100% bamboo fiber terry, our skin-soothing washcloths feel softer & plusher than cotton  , Highly Absorbent and Odorless : Bamboo Fibers are 3 times more absorbent than Cotton due to its porous cross section  , Beautifully Packed: Your face towel set comes carefully packed in an eco-friendly fabric bag which makes it convenient to carry it along at work / travel  , Multipurpose: Use it as a face towel at home or during travel, wash cloth for babies, as sports towel,  , Gently Cleanse: Use them to cleanse without scratching or over-scrubbing. Acne / Pimple Skin Friendly  ",,,,,,24%,"https://m.media-amazon.com/images/I/31WWGrE+zQL.jpg,https://m.media-amazon.com/images/I/51GWFy2vqzL.jpg,https://m.media-amazon.com/images/I/51yfZnwkovL.jpg,https://m.media-amazon.com/images/I/5197dul+YlL.jpg,https://m.media-amazon.com/images/I/41mW3oSYDJL.jpg,https://m.media-amazon.com/images/I/51H6qGFnEmL.jpg,https://m.media-amazon.com/images/I/31BCz168fpL.jpg",,,,,,,,,,,,,,"Avail No Cost EMI on select cards for orders above ₹3000,Upto ₹56.92 discount on select Credit Cards,Get GST  invoice and save up to 28% on business purchases.",,,759,Back to results,,,,,"Mush Bamboo Face Towel | Ultra Soft, Absorbent & Quick Dry Towel for Facewash, Gym, Travel, Yoga. Recommended for Acne Prone Skincare (5, Assorted)"," No Cost EMI , Bank Offer , Partner Offers ",https://www.amazon.in/dp/B0BNNKFCBZ,,,
B09X49HP4M,"1,798","https://images-na.ssl-images-amazon.com/images/G/01/x-locale/common/grey-pixel.gif,https://m.media-amazon.com/images/S/aplus-media-library-service-media/3b07b53c-2704-43a7-acd2-62490c9a8b01.__CR0,0,970,600_PT0_SX970_V1___.png,https://images-na.ssl-images-amazon.com/images/G/01/x-locale/common/grey-pixel.gif,https://m.media-amazon.com/images/S/aplus-media-library-service-media/bcfaf91d-8759-4de9-8be8-c7e7a1488fd9.__CR0,0,970,600_PT0_SX970_V1___.png,https://images-na.ssl-images-amazon.com/images/G/01/x-locale/common/grey-pixel.gif,https://m.media-amazon.com/images/S/aplus-media-library-service-media/65a602e9-1453-4268-bd14-1e5fbf1062c3.__CR0,0,970,600_PT0_SX970_V1___.png,https://images-na.ssl-images-amazon.com/images/G/01/x-locale/common/grey-pixel.gif,https://m.media-amazon.com/images/S/aplus-media-library-service-media/21176b26-cc9a-4986-aef8-6637a5aa1d4b.__CR0,0,970,600_PT0_SX970_V1___.png,https://images-na.ssl-images-amazon.com/images/G/01/x-locale/common/grey-pixel.gif,https://m.media-amazon.com/images/S/aplus-media-library-service-media/8558e2ca-a77c-4d96-946c-ccb05be9e389.__CR0,0,970,600_PT0_SX970_V1___.png,https://images-na.ssl-images-amazon.com/images/G/01/x-locale/common/grey-pixel.gif,https://m.media-amazon.com/images/S/aplus-media-library-service-media/69cacb1d-7bf4-4daa-8d1a-a682db4c6e8a.__CR0,0,970,600_PT0_SX970_V1___.png",,,,," COMFORTABLE : When babies are swaddled, they sleep better & feel safe as babies are used to being wrapped tightly in the womb. Bamboo Fabric is weightless & thermo-regulating which helps to regulate the body temperature based on the weather.  , SOFTER THAN SOFT : The bamboo fabric is super-soft and gentle on your baby’s skin. The soft plush fabric wraps around your baby for a comfortable sleep. It is also the best choice for rash prevention.  , MULTIPURPOSE : Mush Bamboo Swaddles can be used as a play mat, a blanket, a burp cloth, a nursing cover, a picnic blanket. It is one of the best baby shower gifts for every new mom.  ",,,,,,50%,"https://m.media-amazon.com/images/I/41MOg8+34cL.jpg,https://m.media-amazon.com/images/I/51pApkFhhTL.jpg,https://m.media-amazon.com/images/I/41jwgwbCFCL.jpg,https://m.media-amazon.com/images/I/51hEMPKkv5L.jpg,https://m.media-amazon.com/images/I/41qHLWv95cL.jpg,https://m.media-amazon.com/images/I/41-XKzGlEyL.jpg,https://m.media-amazon.com/images/I/41gCzb8YsoL.jpg",,,,,,,,,,,,,,"Avail No Cost EMI on select cards for orders above ₹3000,Upto ₹67.42 discount on select Credit Cards,Get GST  invoice and save up to 28% on business purchases.",,,899,Back to results,4.6,35 global ratings,,,"Mush 100% Bamboo Swaddle : Ultra Soft, Breathable, Thermoregulating, Absorbent, Light Weight and Multipurpose Bamboo Wrapper / Baby Bath Towel / Blanket(2, Golden Leaf & Jungle (Colorful)"," No Cost EMI , Bank Offer , Partner Offers ",https://www.amazon.in/dp/B09X49HP4M,,,
B0BRN1NQD6,899,"https://images-na.ssl-images-amazon.com/images/G/01/x-locale/common/grey-pixel.gif,https://m.media-amazon.com/images/S/aplus-media-library-service-media/3b07b53c-2704-43a7-acd2-62490c9a8b01.__CR0,0,970,600_PT0_SX970_V1___.png,https://images-na.ssl-images-amazon.com/images/G/01/x-locale/common/grey-pixel.gif,https://m.media-amazon.com/images/S/aplus-media-library-service-media/bcfaf91d-8759-4de9-8be8-c7e7a1488fd9.__CR0,0,970,600_PT0_SX970_V1___.png,https://images-na.ssl-images-amazon.com/images/G/01/x-locale/common/grey-pixel.gif,https://m.media-amazon.com/images/S/aplus-media-library-service-media/65a602e9-1453-4268-bd14-1e5fbf1062c3.__CR0,0,970,600_PT0_SX970_V1___.png,https://images-na.ssl-images-amazon.com/images/G/01/x-locale/common/grey-pixel.gif,https://m.media-amazon.com/images/S/aplus-media-library-service-media/21176b26-cc9a-4986-aef8-6637a5aa1d4b.__CR0,0,970,600_PT0_SX970_V1___.png,https://images-na.ssl-images-amazon.com/images/G/01/x-locale/common/grey-pixel.gif,https://m.media-amazon.com/images/S/aplus-media-library-service-media/8558e2ca-a77c-4d96-946c-ccb05be9e389.__CR0,0,970,600_PT0_SX970_V1___.png,https://images-na.ssl-images-amazon.com/images/G/01/x-locale/common/grey-pixel.gif,https://m.media-amazon.com/images/S/aplus-media-library-service-media/69cacb1d-7bf4-4daa-8d1a-a682db4c6e8a.__CR0,0,970,600_PT0_SX970_V1___.png",,,,," COMFORTABLE : When babies are swaddled, they sleep better & feel safe as babies are used to being wrapped tightly in the womb. Bamboo Fabric is weightless & thermo-regulating which helps to regulate the body temperature based on the weather.  , SOFTER THAN SOFT : The bamboo fabric is super-soft and gentle on your baby’s skin. The soft plush fabric wraps around your baby for a comfortable sleep. It is also the best choice for rash prevention.  , MULTIPURPOSE : Mush Bamboo Swaddles can be used as a play mat, a blanket, a burp cloth, a nursing cover, a picnic blanket. It is one of the best baby shower gifts for every new mom.  ",,,,,,44%,"https://m.media-amazon.com/images/I/414epNM9msL.jpg,https://m.media-amazon.com/images/I/41cqOeR8c2L.jpg,https://m.media-amazon.com/images/I/41PX6aSEW4L.jpg,https://m.media-amazon.com/images/I/51mfbyJtNCL.jpg,https://m.media-amazon.com/images/I/41olDLOo1aL.jpg,https://m.media-amazon.com/images/I/41gCzb8YsoL.jpg",,,,,,,,,,,,,,"Avail No Cost EMI on select cards for orders above ₹3000,Upto ₹37.42 discount on select Credit Cards,Get GST  invoice and save up to 28% on business purchases.",,,499,Back to results,4.6,35 global ratings,,,"Mush 100% Bamboo Swaddle : Ultra Soft, Breathable, Thermoregulating, Absorbent, Light Weight and Multipurpose Bamboo Wrapper / Baby Bath Towel / Blanket (1, Geo Peach)"," No Cost EMI , Bank Offer , Partner Offers ",https://www.amazon.in/dp/B0BRN1NQD6,,,
B0BM45JH9N,999,"https://images-na.ssl-images-amazon.com/images/G/01/x-locale/common/grey-pixel.gif,https://m.media-amazon.com/images/S/aplus-media-library-service-media/1a0c49ac-d714-4837-9357-01cc5fd51f6a.__CR0,0,970,600_PT0_SX970_V1___.jpg,https://images-na.ssl-images-amazon.com/images/G/01/x-locale/common/grey-pixel.gif,https://m.media-amazon.com/images/S/aplus-media-library-service-media/6abce386-3091-4ed7-9d75-19cbed07a1b5.__CR0,0,970,600_PT0_SX970_V1___.jpg,https://images-na.ssl-images-amazon.com/images/G/01/x-locale/common/grey-pixel.gif,https://m.media-amazon.com/images/S/aplus-media-library-service-media/907d066c-dded-4f38-a8e3-6676efc06ff3.__CR0,0,970,600_PT0_SX970_V1___.jpg,https://images-na.ssl-images-amazon.com/images/G/01/x-locale/common/grey-pixel.gif,https://m.media-amazon.com/images/S/aplus-media-library-service-media/bc4596e5-0dbd-415e-8d2d-4d6559eaa55c.__CR0,0,970,600_PT0_SX970_V1___.jpg,https://images-na.ssl-images-amazon.com/images/G/01/x-locale/common/grey-pixel.gif,https://m.media-amazon.com/images/S/aplus-media-library-service-media/88143842-e0a3-48c6-9f82-9cb8451c71cb.__CR0,0,970,600_PT0_SX970_V1___.jpg,https://m.media-amazon.com/images/S/aplus-media-library-service-media/b5efed3d-0840-4852-8050-eafa275cade8.__CR0,0,1500,3000_PT0_SX150_V1___.jpg,https://m.media-amazon.com/images/S/aplus-media-library-service-brand-media/34123fdcda8fd58ba9562d4b9368dd21.w1500.h1875.__CR477,0,938,1875_PT0_SX150_V1___.jpg,https://m.media-amazon.com/images/S/aplus-media-library-service-media/4943d041-e861-43f6-ba83-2ba1d8a0184e.__CR0,0,1500,3000_PT0_SX150_V1___.jpg,https://m.media-amazon.com/images/S/aplus-media-library-service-media/cfe9d0d6-7302-4ee6-8cfa-5a220f13e58b.__CR0,0,1500,3000_PT0_SX150_V1___.jpg,https://m.media-amazon.com/images/S/aplus-media-library-service-media/b0d2cfac-8560-41eb-a3a1-8c405c986b0c.__CR0,0,1500,3000_PT0_SX150_V1___.jpg,https://m.media-amazon.com/images/S/aplus-media-library-service-media/abcb155c-44f1-4df2-bcde-76dd08f343f7.__CR0,0,1500,3000_PT0_SX150_V1___.jpg",,,,," Care Instructions: Machine Wash  , SUPERIOR INNOVATIVE DESIGN: Softness of Bamboo, quick sweat absorption properties and breathable & elastic mesh ensures a smooth grip and supreme comfort. Cushion pads under the feet and combed Bamboo fabric keeps your feet dry all day. Ideal for sports, running or any physical activity.  , ANTI ODOUR: Odour control through natural anti-bacterial property of bamboo material. Inhibits the growth of odour causing bacteria that create foul foot smell. It also keeps your feet free from infections and the softness of the bamboo fabric prevents friction injuries like rashes and ulcers.  , EXTRA SOFT - Bamboo fiber is known for its softness. Spandex blended with Bamboo makes these socks the best product in softness, cushioning and impact protection. Heelium's athletic cum marathon socks are 2-3 times stronger and more durable then cotton, nylon or polyester socks.  , PERFECT SIZE: MEN Fits UK 7 - UK 11 (25 cm to 28 cm). Great to wear this pair of shoes. They fit snug and provide the right amount of support to the heel, arch and the ankle, also provide a nice combination of thick and thin areas as per the foot shape requirments for men, women, boys, girls and the elderly. Please choose the correct size as per your feet.  ",,,11 November 2022,Men,,30%,,,,,,,,,,,,,,1.00 count,"Avail No Cost EMI on select cards for orders above ₹3000,Upto ₹69.90 discount on select Credit Cards, Federal Bank Debit Cards,Get GST  invoice and save up to 28% on business purchases.",,,699,Back to results,4.2,5 global ratings,10% Instant Discount up to INR 300 on Federal Bank Debit Card Trxns. Minimum purchase value INR 150010% Instant Discount up to INR 300 on Federal Bank Credit Card Trxns. Minimum purchase value INR 20005%  Instant Discount up to INR 250 on HSBC Cashback Card Credit Card Transactions. Minimum purchase value INR 1000No cost EMI available on select cards. Please check 'EMI options' above for more details.Get GST  invoice and save up to 28% on business purchases.,,"Mush Bamboo Performance Socks for Sports & Casual Wear-Ultra Soft, Anti Odor, Breathable Mesh Design Ankle Length Pack of 3 UK Size 7-11"," No Cost EMI , Bank Offer , Partner Offers ",https://www.amazon.in/dp/B0BM45JH9N,,,100 g
