ASIN,MRP,aplus_images,aplus_text,attributes,best_sellers_rank,brand,bullets,collection,country_of_origin,date_first_available,department,description,discount,image_links,important_info,importer,is_discontinued_by_manufacturer,item_height,item_height_unit,item_length,item_length_unit,item_width,item_width_unit,material,metal,model_number,net_quantity,offers,packaging,packer,price,product_path,ratings,ratings_count,special_offers,stone,title,type_of_offers,url,video_links,warranty_type,weight
B0855W7KL4,"1,998",,,,,," These amazingly soft Turkish style Bath towels are made from 100% Bamboo. Size: 75 X 150 cms / 29.5"" X 59"" ; Pack of 2 - Beige & Grey  , Features: It dries very quickly, absorbs 3 times more water than cotton, light in weight and takes up little space in your closet or luggage. It's great for Home / Travel use, baby care, home decor, and possibilities are endless! It can be styled as a scarf as well as a baby summer blanket.  , Usage: It's great for Home / Travel use, baby care, home decor, and possibilities are endless! It can be styled as a scarf as well as a baby summer blanket.  , Packaging: It comes packed in a small cotton bag which makes it super convenient to store and to carry while travelling  , Washcare: Machine Washable. Do not bleach.  ",,,,,"These amazingly soft Turkish style towels are made from 100% Bamboo. It dries very quickly, light in weight and takes up little space in your closet or luggage. It's great for bath, pools, spa's, beaches, sport facilities, baby care, even as part of your home decor. Our towels are perfect in warm climates or cold climates and for traveling, as they dry very quickly, are highly absorbent and highly compact. It comes along with a complimentary small bag to pack it and take it along wherever you go",30%,"https://m.media-amazon.com/images/I/316iCniO0fL.jpg,https://m.media-amazon.com/images/I/A1SH+FC11SL.png,https://m.media-amazon.com/images/I/5125fc0FQOS.jpg,https://m.media-amazon.com/images/I/41k0gzjAUzL.jpg,https://m.media-amazon.com/images/I/41fLiyNBttL.jpg,https://m.media-amazon.com/images/I/51oweqqT8AL.jpg",,,,,,,,,,,,,,"Avail No Cost EMI on select cards for orders above ₹3000,Upto ₹104.92 discount on select Credit Cards,Get GST  invoice and save up to 28% on business purchases.",,,"1,399",Back to results,4.2,"2,323 global ratings",,,"Mush Bamboo-Derived Rayon Turkish Towel (Set Of 2, Grey/Beige, 29 X 59 Inches), 250 Gsm"," No Cost EMI , Bank Offer , Partner Offers ",https://www.amazon.in/dp/B0855W7KL4,,,
B0BP7QW7KV,"5,998","https://images-na.ssl-images-amazon.com/images/G/01/x-locale/common/grey-pixel.gif,https://m.media-amazon.com/images/S/aplus-media-library-service-media/281d5d30-169b-48df-aaed-3f6a59cb17c3.__CR0,0,970,300_PT0_SX970_V1___.jpg,https://images-na.ssl-images-amazon.com/images/G/01/x-locale/common/grey-pixel.gif,https://m.media-amazon.com/images/S/aplus-media-library-service-media/85ce47c1-cda7-4040-95d9-38d749d60862.__CR0,0,300,300_PT0_SX300_V1___.jpg,https://images-na.ssl-images-amazon.com/images/G/01/x-locale/common/grey-pixel.gif,https://m.media-amazon.com/images/S/aplus-media-library-service-media/734c7131-6c76-4525-9c6f-1c604ec856ec.__CR0,0,300,300_PT0_SX300_V1___.jpg,https://images-na.ssl-images-amazon.com/images/G/01/x-locale/common/grey-pixel.gif,https://m.media-amazon.com/images/S/aplus-media-library-service-media/9aba6165-4dbf-487b-b4c2-892675f479ef.__CR0,0,300,300_PT0_SX300_V1___.jpg,https://images-na.ssl-images-amazon.com/images/G/01/x-locale/common/grey-pixel.gif,https://m.media-amazon.com/images/S/aplus-media-library-service-media/6e7b16bf-aa2d-4150-af6b-52db8403638e.__CR0,0,970,300_PT0_SX970_V1___.jpg,https://images-na.ssl-images-amazon.com/images/G/01/x-locale/common/grey-pixel.gif,https://m.media-amazon.com/images/S/aplus-media-library-service-media/b0c33d3c-fde2-4270-a0fa-8b55f9ab0070.__CR0,0,970,300_PT0_SX970_V1___.jpg,https://images-na.ssl-images-amazon.com/images/G/01/x-locale/common/grey-pixel.gif,https://m.media-amazon.com/images/S/aplus-media-library-service-media/012f3bcd-03bd-4124-ae21-473120ac93ee.__CR0,0,970,300_PT0_SX970_V1___.jpg","The Better Home Bamboo Bath Towel for men and women is made of premium quality fabric to give you a spa-like experience with its ultra soft fluffiness.These towels for bath prevent bacterial build up and also helps in preventing upto 70% of odour. These premium bath towels are designed to be soft and gentle on your skin.These multi utility towels are made with plant based fibre and are 2x more absorbent than your regular towels, making them the perfect choice for your kitchen and bath.",,,," BAMBOO BATH TOWEL: Get a spa-like experience with these extra fluffy Bamboo Bath Towels for Men & Women. Crafted from Natural Plant-Based Bamboo Fiber, this bamboo towel is ultra soft and gentle on the skin.  , MACHINE WASHABLE BATHING TOWEL: Our bathing towel is Machine washable these light weight bath towels and keep them fluffier for longer.  , HYPER ABSORBENT BAMBOO TOWEL: The material used in this bamboo bath towel for men and women makes it 2x more absorbent as compared to a regular towel.  , ANTI-BACTERIAL AND ANTI-ODOUR: Not only do these bath towels prevent bacterial buildup, but also prevent upto 70% of odour due to the natural properties of the bamboo fiber.  , CARE INSTRUCTIONS: For best results, wash/soak separately before first use.  ",,,,,,80%,"https://m.media-amazon.com/images/I/51+LkB2NL2L.jpg,https://m.media-amazon.com/images/I/61+OtNn2ymL.jpg,https://m.media-amazon.com/images/I/51a42KlOp6L.jpg,https://m.media-amazon.com/images/I/41n1KKMJKjL.jpg,https://m.media-amazon.com/images/I/61hZnYi8PoL.jpg,https://m.media-amazon.com/images/I/61dEGLa0l7L.jpg,https://m.media-amazon.com/images/I/51OMbLgjpzL.jpg",,,,,,,,,,,,,,"Avail No Cost EMI on select cards for orders above ₹3000,Upto ₹89.92 discount on select Credit Cards,Get GST  invoice and save up to 28% on business purchases.",,,"1,199",Back to results,4.0,56 global ratings,,,"The Better Home Bamboo Bath Towel for Men & Women | 450GSM Bamboo Towel | Ultra Soft, Hyper Absorbent & Anti Odour Bathing Towel | 27x54 inches (Pack of 2, Beige)"," No Cost EMI , Bank Offer , Partner Offers ",https://www.amazon.in/dp/B0BP7QW7KV,,,
B0728KV2ZL,850,"https://images-na.ssl-images-amazon.com/images/G/01/x-locale/common/grey-pixel.gif,https://m.media-amazon.com/images/S/aplus-media/sota/1410d567-3597-43f7-bdba-29f07cb8c325._CR155,0,1189,1189_PT0_SX300__.jpg,https://images-na.ssl-images-amazon.com/images/G/01/x-locale/common/grey-pixel.gif,https://m.media-amazon.com/images/S/aplus-media/sota/5aad0228-df60-4a5a-a9eb-f51fcb2740b4._CR0,0,1500,1500_PT0_SX300__.jpg,https://images-na.ssl-images-amazon.com/images/G/01/x-locale/common/grey-pixel.gif,https://m.media-amazon.com/images/S/aplus-media/sota/55f11778-4843-4a3c-9c67-0cb85d8e80f5._CR0,0,1500,1500_PT0_SX300__.jpg,https://images-na.ssl-images-amazon.com/images/G/01/x-locale/common/grey-pixel.gif,https://m.media-amazon.com/images/S/aplus-media/sota/25785137-cb8b-46a0-aad4-4d37eaf79df4._CR0,0,300,300_PT0_SX300__.jpg,https://images-na.ssl-images-amazon.com/images/G/01/x-locale/common/grey-pixel.gif,https://m.media-amazon.com/images/S/aplus-media/sota/898335ae-12a5-46a1-93e5-e08a5c285b32._CR0,0,300,300_PT0_SX300__.jpg","The Solimo 12-Piece face towel set comes in 3 different colour combinations   - turquoise blue, olive green and baby pink which comes in handy after   washing the face with a splash of cool water. You can use these face towels   in your spa rituals or after shaving. You can use them for make-up removal by   soaking the towels in warm water and gently wiping the face. These 100%   cotton face towels are extra-soft, absorbent and treat your delicate facial   skin gently. They are fade resistant and machine washable.Made from 100% cotton, Solimo towels are gentle, luxurious  and soft on the skin. These towels will soak up water fast and dry  quickly for a fresh feeling with each use.Solimo towels are long-lasting and luxuriously soft as they  are made from cotton that has been specially processed to retain only  strong and long cotton fibres. The combed cotton also reduces thread  breakage and buildup of lint keeping the towels fresh for a longer time.For best use, wash separately on first use. hand wash,  machine wash warm, do not use bleach, line dry in shade, do not iron, Do  not dry clean.Solimo towels are available in 5 specially processed fade  resistant colours – Iris Blue, Spanish Red, Paradise Pink, Sunshine  Yellow and Spring Green. Choose from different colour combination packs  to find sets that best suits your taste.Welcome to the world of Solimo – a place where premium  quality and great value go hand in hand. Every Solimo product is  carefully built to deliver exceptional quality. Right from the materials  used, to detailed quality checks, to thoughtful improvements, quality  is at the core of everything we do. We invest our resources only on what  is important to you and minimize costs on things like packaging,  advertising and other extras that don’t add value. This helps us keep  our costs low and create products that deliver more value for the price  you pay. Expect a little more every time you buy a Solimo product.",,,," 100% cotton, extra soft and absorbent  , Plush 500 GSM towels  , Long-lasting fade resistant fabric  , Size: 30x30 cm  , Pack contents: 12 face towels  , Colours: Turquoise Blue, Olive Green and Baby Pink  ",,,,,,40%,"https://m.media-amazon.com/images/I/51GHC+U9dbL.jpg,https://m.media-amazon.com/images/I/51pFtPU9pYL.jpg,https://m.media-amazon.com/images/I/51MVvi8lzGL.jpg,https://m.media-amazon.com/images/I/61C-lANX0mL.jpg,https://m.media-amazon.com/images/I/61YtEIBQGDL.jpg,https://m.media-amazon.com/images/I/31RL+p2edDL.jpg",,,,,,,,,,,,,,,,,509,Back to results,4.1,"4,187 global ratings",,,"Amazon Brand - Solimo 100% Cotton 12 Piece Towel Set, 500 GSM (Turquoise Blue, Olive Green and Baby Pink)",,https://www.amazon.in/dp/B0728KV2ZL,,,
B08WPWB9MT,799,"https://images-na.ssl-images-amazon.com/images/G/01/x-locale/common/grey-pixel.gif,https://m.media-amazon.com/images/S/aplus-media-library-service-media/a8412a06-1ad7-44f0-9be7-3ad067ade9b8.__CR0,0,970,600_PT0_SX970_V1___.png,https://images-na.ssl-images-amazon.com/images/G/01/x-locale/common/grey-pixel.gif,https://m.media-amazon.com/images/S/aplus-media-library-service-media/666ae8b0-b6a4-4a89-84c7-a238dd25578c.__CR189,0,720,720_PT0_SX300_V1___.png,https://images-na.ssl-images-amazon.com/images/G/01/x-locale/common/grey-pixel.gif,https://m.media-amazon.com/images/S/aplus-media-library-service-media/d18b71b7-bbe9-469c-a550-0fe172d64d10.__CR58,0,982,982_PT0_SX300_V1___.png,https://images-na.ssl-images-amazon.com/images/G/01/x-locale/common/grey-pixel.gif,https://m.media-amazon.com/images/S/aplus-media-library-service-media/38a8ae76-4ca8-4320-b909-92f9497b6b5d.__CR152,0,771,771_PT0_SX300_V1___.png,https://images-na.ssl-images-amazon.com/images/G/01/x-locale/common/grey-pixel.gif,https://m.media-amazon.com/images/S/aplus-media-library-service-media/b8efe658-156d-4165-8fe4-27569abd0670.__CR606,0,1877,1877_PT0_SX220_V1___.jpg,https://images-na.ssl-images-amazon.com/images/G/01/x-locale/common/grey-pixel.gif,https://m.media-amazon.com/images/S/aplus-media-library-service-media/974b2ddb-eacb-4205-a4c2-ff4fce844bab.__CR571,0,1877,1877_PT0_SX220_V1___.jpg,https://images-na.ssl-images-amazon.com/images/G/01/x-locale/common/grey-pixel.gif,https://m.media-amazon.com/images/S/aplus-media-library-service-media/3815c400-9047-471f-b326-5ea3666749bb.__CR567,0,1877,1877_PT0_SX220_V1___.jpg,https://images-na.ssl-images-amazon.com/images/G/01/x-locale/common/grey-pixel.gif,https://m.media-amazon.com/images/S/aplus-media-library-service-media/64c22629-003b-413f-ad0d-c2821a7682c3.__CR605,0,1877,1877_PT0_SX220_V1___.jpg,https://images-na.ssl-images-amazon.com/images/G/01/x-locale/common/grey-pixel.gif,https://m.media-amazon.com/images/S/aplus-media-library-service-media/ba897a82-9e33-47a7-b8ae-c55b51f9337a.__CR98,52,982,607_PT0_SX970_V1___.png","After consulting many hair stylists, we have made Mush Bamboo hair wraps / Turban towels, which are good for hair compared to regular terry towels. If you’re looking to streamline your hair drying routine, now’s the perfect time to start with us !Mush Hair Towel is extremely lightweight which makes it easy to carry wherever you go! Perfect for routine hair wash, gym, traveling, beach excursions, sports, camping, water park, outdoors, home, hotels, pool parties and professional hair salon use.When hair is wet, it becomes much more vulnerable and prone to breakage than normal. Using a regular body towel can cause hair damage over time, it can further also increase the amount of frizz you encounter every day. That’s where a hair drying towel comes to your rescue- A hair towel wrap is specifically made to perfectly absorb all the extra moisture in your hair.Say goodbye to your hair dryers as Mush Hair towel is here to protect you from all the damage instigated by long term use of hair dryers.After washing your hair, wrap it in the towel and close it with the button. You can be sure that the hair towel will not be slipping off. Your head stays warm and comfortable as your hair dries.Our microfiber hair towel is made from bamboo that is extremely soft to the touch, super absorbent and fast drying. The advanced fabric absorbs more than 10 times its weight in water.Hair should be about 70% dry before you start going in with the blow-dryer. The longer your hair is exposed to the heat, the more damage is likely to occur. Less blow drying is better for the health and sheen of your hair.Ideal for home, travelling, spa, gym, hotel, saloons, beauty clinics, work from home and gifting.",,,," After bathing, twist into a headscarf like a normal towel, hook the loops on the buttons to fix them in place. The button helps it to use in two ways : either forward or backward side like a turban.  , Mush Hair Towels are made out of 100% Bamboo fabric which makes it extremely soft, Absorbent, & Anti-odor. It reduces hair drying time to half !  , Mush hair towel size is 25cms * 60cms, available in many colors : white, dark grey, baby pink, sky blue, light grey that can be selected according to your preferences.  , This towel is extremely lightweight and comes in a fabric bag which makes it easy to carry wherever you go! Perfect for routine hair wash, gym, traveling, beach excursions, sports, camping, water park, outdoors, home, hotels, pool parties and professional hair salon use.  , This towel helps you to minimize damage caused by water, blow dryers, cotton towels and even air drying, hair looks smoother and shinier. Hair is less frizzy & styles better and even your color lasts longer. Hands-free drying.  ",,,,,,43%,"https://m.media-amazon.com/images/I/41LNCe7dTuL.jpg,https://m.media-amazon.com/images/I/51E3X6FRkaL.jpg,https://m.media-amazon.com/images/I/41lfONnDiLS.jpg,https://m.media-amazon.com/images/I/41uRvlrEATL.jpg",,,,,,,,,,,,,,"Avail No Cost EMI on select cards for orders above ₹3000,Upto ₹34.42 discount on select Credit Cards,Get GST  invoice and save up to 28% on business purchases.",,,459,Back to results,4.0,303 global ratings,,,"Mush Bamboo Ultra Soft & Absorbent Hair Wrap Towel (Light Grey,1) 500 GSM"," No Cost EMI , Bank Offer , Partner Offers ",https://www.amazon.in/dp/B08WPWB9MT,,,
B07KXV7MQR,999,"https://images-na.ssl-images-amazon.com/images/G/01/x-locale/common/grey-pixel.gif,https://m.media-amazon.com/images/S/aplus-media-library-service-media/088bb2e0-6376-4aea-a3b1-49921dc992b8.__CR0,0,2822,1157_PT0_SX1464_V1___.jpg,https://images-na.ssl-images-amazon.com/images/G/01/x-locale/common/grey-pixel.gif,https://m.media-amazon.com/images/S/aplus-media-library-service-media/66a472a6-2e54-41e4-957c-9d103ff85d7a.__CR0,0,2823,1157_PT0_SX1464_V1___.jpg,https://images-na.ssl-images-amazon.com/images/G/01/x-locale/common/grey-pixel.gif,https://m.media-amazon.com/images/S/aplus-media-library-service-media/3ce0a77a-db61-4674-b5a1-2a443be21a42.__CR0,0,2823,1157_PT0_SX1464_V1___.jpg,https://images-na.ssl-images-amazon.com/images/G/01/x-locale/common/grey-pixel.gif,https://m.media-amazon.com/images/S/aplus-media-library-service-media/50e8fe3c-290f-49a2-8b32-33d925a2a2db.__CR0,0,2822,1157_PT0_SX1464_V1___.jpg,https://images-na.ssl-images-amazon.com/images/G/01/x-locale/common/grey-pixel.gif,https://m.media-amazon.com/images/S/aplus-media-library-service-media/d2efcfa4-683d-4062-b338-7aad19e80977.__CR0,0,2823,1157_PT0_SX1464_V1___.jpg,https://images-na.ssl-images-amazon.com/images/G/01/x-locale/common/grey-pixel.gif,https://m.media-amazon.com/images/S/aplus-media-library-service-media/d4c4f0d6-417a-4bdc-b82d-01024f259679.__CR0,0,2823,1157_PT0_SX1464_V1___.jpg,https://images-na.ssl-images-amazon.com/images/G/01/x-locale/common/grey-pixel.gif,https://m.media-amazon.com/images/S/aplus-media-library-service-media/d75eff6c-9347-460c-a93f-d93a8e1e5283.__CR0,1,2822,1157_PT0_SX1464_V1___.jpg",,,,," Super Soft - Bamboo fiber is known for its softness. These super soft bamboo towels give you an experience of luxury & warmth.  , Quick Absorbent: The internal hollow fiber structure of these towels make them 3 times more absorbent than the cotton towels available. These soft bamboo face towels are suitable for sweat & moisture absorption.  , Odour free : Bamboo fiber has antibacterial properties which ensures the towels are odour free.  , Skin protection -These towels are ideal for daily use as they have been strategically designed for everyone’s needs. Bamboo adds natural antimicrobial qualities; making our towels superior for sensitive skin and allergies. Because of these properties, they resist fungus, even in humid environments.  , Multipurpose: Heelium’s Face towels can be used as a regular face towel, a yoga towel, a gym towel, etc  ",,India,27 November 2018,,,30%,"https://m.media-amazon.com/images/I/414UMQydWLS.jpg,https://m.media-amazon.com/images/I/41tWccWtHtL.jpg,https://m.media-amazon.com/images/I/51YIAwc4RvL.jpg,https://m.media-amazon.com/images/I/41aWCm-E2iL.jpg,https://m.media-amazon.com/images/I/51Hbh5skmYL.jpg,https://m.media-amazon.com/images/I/51sx+xEzUhL.jpg,https://m.media-amazon.com/images/I/61YVzbbvqRL.jpg",1.These towels are machine washable with lukewarm water on delicate wash with like colors and thoroughly rinse. 2.Do not add bleach. 3.Tumble dry with no or low heat setting. 4.We do not recommend the use of fabric softeners as they tend to block the micro-gaps in the fibers leading to reduced absorbency.,,No,,,,,,,,,,2.00 count,,,,699,Back to results,4.4,227 global ratings,5% voucher applied to one item per order at checkout7.5% Instant Discount up to INR 1500 on Standard Chartered Bank Credit Card EMI Trxn. Minimum purchase value INR 100007.5% Instant Discount up to INR 1500 on Amex Credit Card EMI Trxn. Minimum purchase value INR 100005%  Instant Discount up to INR 250 on HSBC Cashback Card Credit Card Transactions. Minimum purchase value INR 1000No cost EMI available on select cards. Please check 'EMI options' above for more details.Get GST  invoice and save up to 28% on business purchases.,,"HEELIUM Small Hand Size Bamboo Towel (40 x 65 CM), Antibacterial & Ultra Soft, 600 GSM, Set of 2 (Grey, Teal)",,https://www.amazon.in/dp/B07KXV7MQR,,,420 g
B0BC96YLS5,"1,499","https://images-na.ssl-images-amazon.com/images/G/01/x-locale/common/grey-pixel.gif,https://m.media-amazon.com/images/S/aplus-media-library-service-media/20ca7f25-a076-48a1-ae60-c93c439e1374.__CR0,0,970,600_PT0_SX970_V1___.png,https://images-na.ssl-images-amazon.com/images/G/01/x-locale/common/grey-pixel.gif,https://m.media-amazon.com/images/S/aplus-media-library-service-media/511cb215-5025-4eca-9e3f-a3c8fcf82992.__CR0,0,970,600_PT0_SX970_V1___.png,https://images-na.ssl-images-amazon.com/images/G/01/x-locale/common/grey-pixel.gif,https://m.media-amazon.com/images/S/aplus-media-library-service-media/7910a4df-8737-401c-bd0b-f87c2cf79b50.__CR0,0,970,600_PT0_SX970_V1___.png,https://images-na.ssl-images-amazon.com/images/G/01/x-locale/common/grey-pixel.gif,https://m.media-amazon.com/images/S/aplus-media-library-service-media/579a28c0-7e5b-494c-ad96-8edeec08879e.__CR0,0,970,600_PT0_SX970_V1___.png,https://images-na.ssl-images-amazon.com/images/G/01/x-locale/common/grey-pixel.gif,https://m.media-amazon.com/images/S/aplus-media-library-service-media/e9f7eb13-2ab9-42c2-b8a8-d957c4c7e056.__CR0,0,970,600_PT0_SX970_V1___.png",,,,," SKIN-FRIENDLY : Mush hooded towels are composed of bamboo fiber, which is naturally hypoallergenic and free of any additives that could affect the sensitive skin of kids. As a result, our hooded baby towel is a safe, natural, and first choice for kids.  , SUPER ABSORBENT : The Bamboo Fabric is more absorbent & breathable than any other fabric due to a wider cross section. This allows it to absorb 4x times more water while preventing dampen odor common in other cotton towels.  , SOFTER THAN SOFT : The bamboo fabric is super-soft and gentle on the skin. The towel is made from bamboo which provides a silky soft touch while absorbing all traces of moisture efficiently from the body's surface. The soft plush fabric ensures comfort, longevity, and absorbency.  , KIDS ESSENTIAL : When you’re checking off Kids’ essentials, “Mush baby hooded towel,” is at the top of the list. Whether it’s for a boy or girl, or you’re looking for a unisex gift, helps make life a little easier for your fellow parents.  , QUALITY : unique designs, made up with soft and skin friendly fabric. Hooded towels are value-priced.  ",,,,,,47%,"https://m.media-amazon.com/images/I/41iql8TVE-L.jpg,https://m.media-amazon.com/images/I/518VCZjYBrL.jpg,https://m.media-amazon.com/images/I/41GFna5IVGL.jpg,https://m.media-amazon.com/images/I/41pt+hsWc1L.jpg,https://m.media-amazon.com/images/I/310XBIvjCnL.jpg,https://m.media-amazon.com/images/I/41-o96s300L.jpg",,,,,,,,,,,,,,"Avail No Cost EMI on select cards for orders above ₹3000,Upto ₹59.92 discount on select Credit Cards,Get GST  invoice and save up to 28% on business purchases.",,,799,Back to results,4.2,8 global ratings,,,"Mush Ultra Soft & Super Absorbent Bamboo Hooded Towel for Kids (1, Rustic Orange)"," No Cost EMI , Bank Offer , Partner Offers ",https://www.amazon.in/dp/B0BC96YLS5,,,
B0BRKV7R6J,"2,697","https://images-na.ssl-images-amazon.com/images/G/01/x-locale/common/grey-pixel.gif,https://m.media-amazon.com/images/S/aplus-media-library-service-media/3b07b53c-2704-43a7-acd2-62490c9a8b01.__CR0,0,970,600_PT0_SX970_V1___.png,https://images-na.ssl-images-amazon.com/images/G/01/x-locale/common/grey-pixel.gif,https://m.media-amazon.com/images/S/aplus-media-library-service-media/bcfaf91d-8759-4de9-8be8-c7e7a1488fd9.__CR0,0,970,600_PT0_SX970_V1___.png,https://images-na.ssl-images-amazon.com/images/G/01/x-locale/common/grey-pixel.gif,https://m.media-amazon.com/images/S/aplus-media-library-service-media/65a602e9-1453-4268-bd14-1e5fbf1062c3.__CR0,0,970,600_PT0_SX970_V1___.png,https://images-na.ssl-images-amazon.com/images/G/01/x-locale/common/grey-pixel.gif,https://m.media-amazon.com/images/S/aplus-media-library-service-media/21176b26-cc9a-4986-aef8-6637a5aa1d4b.__CR0,0,970,600_PT0_SX970_V1___.png,https://images-na.ssl-images-amazon.com/images/G/01/x-locale/common/grey-pixel.gif,https://m.media-amazon.com/images/S/aplus-media-library-service-media/8558e2ca-a77c-4d96-946c-ccb05be9e389.__CR0,0,970,600_PT0_SX970_V1___.png,https://images-na.ssl-images-amazon.com/images/G/01/x-locale/common/grey-pixel.gif,https://m.media-amazon.com/images/S/aplus-media-library-service-media/69cacb1d-7bf4-4daa-8d1a-a682db4c6e8a.__CR0,0,970,600_PT0_SX970_V1___.png",,,,," COMFORTABLE : When babies are swaddled, they sleep better & feel safe as babies are used to being wrapped tightly in the womb. Bamboo Fabric is weightless & thermo-regulating which helps to regulate the body temperature based on the weather.  , SOFTER THAN SOFT : The bamboo fabric is super-soft and gentle on your baby’s skin. The soft plush fabric wraps around your baby for a comfortable sleep. It is also the best choice for rash prevention.  , MULTIPURPOSE : Mush Bamboo Swaddles can be used as a play mat, a blanket, a burp cloth, a nursing cover, a picnic blanket. It is one of the best baby shower gifts for every new mom.  ",,,,,,52%,"https://m.media-amazon.com/images/I/41YKO1HapEL.jpg,https://m.media-amazon.com/images/I/41sg6mYE4GL.jpg,https://m.media-amazon.com/images/I/412GUjBGGCL.jpg,https://m.media-amazon.com/images/I/41TXIulooaL.jpg,https://m.media-amazon.com/images/I/41ysRqi8GML.jpg,https://m.media-amazon.com/images/I/51xd0y2q5HL.jpg,https://m.media-amazon.com/images/I/41BVVZxRwiL.jpg",,,,,,,,,,,,,,"Avail No Cost EMI on select cards for orders above ₹3000,Upto ₹97.42 discount on select Credit Cards,Get GST  invoice and save up to 28% on business purchases.",,,"1,299",Back to results,4.6,35 global ratings,,,"Mush 100% Bamboo Swaddle : Ultra Soft, Breathable, Thermoregulating, Absorbent, Light Weight and Multipurpose Bamboo Wrapper / Baby Bath Towel / Blanket (3, Sea Grey,Rabbit Blue - Geo Mustard)"," No Cost EMI , Bank Offer , Partner Offers ",https://www.amazon.in/dp/B0BRKV7R6J,,,
