ASIN,MRP,aplus_images,aplus_text,attributes,best_sellers_rank,brand,bullets,collection,country_of_origin,date_first_available,department,description,discount,image_links,important_info,importer,is_discontinued_by_manufacturer,item_height,item_height_unit,item_length,item_length_unit,item_width,item_width_unit,material,metal,model_number,net_quantity,offers,packaging,packer,price,product_path,ratings,ratings_count,special_offers,stone,title,type_of_offers,url,video_links,warranty_type,weight
B0BNBVHKZW,"2,499","https://images-na.ssl-images-amazon.com/images/G/01/x-locale/common/grey-pixel.gif,https://m.media-amazon.com/images/S/aplus-media-library-service-media/bc64f236-d030-4c6b-9cf4-6bfd8275e1e8.__CR0,0,970,600_PT0_SX970_V1___.jpg,https://images-na.ssl-images-amazon.com/images/G/01/x-locale/common/grey-pixel.gif,https://m.media-amazon.com/images/S/aplus-media-library-service-media/238b91d8-ebcc-4111-8161-d9906849ef2d.__CR0,0,970,600_PT0_SX970_V1___.png,https://images-na.ssl-images-amazon.com/images/G/01/x-locale/common/grey-pixel.gif,https://m.media-amazon.com/images/S/aplus-media-library-service-media/0365d879-8260-4826-b26f-0abe17bc83f5.__CR0,0,970,600_PT0_SX970_V1___.png,https://images-na.ssl-images-amazon.com/images/G/01/x-locale/common/grey-pixel.gif,https://m.media-amazon.com/images/S/aplus-media-library-service-media/2cff562a-c1ae-469a-b030-e24a2e34cd97.__CR0,0,970,600_PT0_SX970_V1___.png,https://images-na.ssl-images-amazon.com/images/G/01/x-locale/common/grey-pixel.gif,https://m.media-amazon.com/images/S/aplus-media-library-service-media/74e2f908-bf06-40eb-b201-ae7ad5f234b1.__CR0,0,970,600_PT0_SX970_V1___.jpg,https://images-na.ssl-images-amazon.com/images/G/01/x-locale/common/grey-pixel.gif,https://m.media-amazon.com/images/S/aplus-media-library-service-media/18eb1a31-9e0f-4fe4-9eb6-b0ff61c73b83.__CR0,0,970,600_PT0_SX970_V1___.jpg,https://m.media-amazon.com/images/S/aplus-media-library-service-brand-media/9468c3a6ca8357bfec379ccf1d226b71.w2000.h3000.__CR0,0,1500,3000_PT0_SX150_V1___.jpg,https://m.media-amazon.com/images/S/aplus-media-library-service-media/e228986f-4e4c-4834-b8cc-8982378f980a.__CR0,0,1500,3000_PT0_SX150_V1___.jpg,https://m.media-amazon.com/images/S/aplus-media-library-service-media/44f22423-b851-4638-a058-22132b30470e.__CR82,0,300,600_PT0_SX150_V1___.png,https://m.media-amazon.com/images/S/aplus-media-library-service-media/59003d75-f736-4e4e-83c3-b351328e6ec2.__CR157,0,540,1080_PT0_SX150_V1___.png,https://m.media-amazon.com/images/S/aplus-media-library-service-media/89d8dd65-7f97-40b7-a4e7-c64521a11ced.__CR245,0,540,1080_PT0_SX150_V1___.jpg,https://m.media-amazon.com/images/S/aplus-media-library-service-media/e9f7eb13-2ab9-42c2-b8a8-d957c4c7e056.__CR545,0,300,600_PT0_SX150_V1___.png",,,,," ANTI-SLIP MAT - Mush Wooden Mat comes with silicon non-skid pads. The bottom is padded with rubber grip tape that is non-slip on all kinds of surfaces. Ideal for home or room entrance, balconies, bathrooms & outdoor areas near pools or bath tubs or even near your patio or garden for safe, secure footing even when faced with high temperatures & damp conditions.  , DURABLE, WATERPROOF & LONG LASTING- The seasoned wooden bamboo mat is temperature treated to be waterproof and to stay far from mold and odor; a lattice design lets water and air flow freely. Would not stain or sag; lighter than teak wood and stronger than plastic or rubber which makes them Durable for a long term usage.  , GREAT UNDER-PAD FOR FABRIC RUGS - Place your rug on top of this bamboo bath mat to create airflow, keep the rug dry, and prevent odors  , EASY TO  CLEAN - Our wooden mats are available in appropriate sizes & much easier to clean than fabric floor rugs, spray with water or wipe with a damp cloth to clean & lean on the side to dry.  , PROVIDES SAFETY & STABILITY for babies, toddlers, kids, children, and the elderly when they’re bathing. Protect your flooring and provide you with safer, more stable footing.  ",,,,,,40%,"https://m.media-amazon.com/images/I/51PJ29NsHIL.jpg,https://m.media-amazon.com/images/I/41OxLqvmwXL.jpg,https://m.media-amazon.com/images/I/51Ud95xOhZL.jpg,https://m.media-amazon.com/images/I/41ynl4q3q3L.jpg,https://m.media-amazon.com/images/I/51E4P0PLyxL.jpg,https://m.media-amazon.com/images/I/51YjBitaKYL.jpg,https://m.media-amazon.com/images/I/614zwsgNMTL.jpg",,,,,,,,,,,,,,"Avail No Cost EMI on select cards for orders above ₹3000,Upto ₹112.42 discount on select Credit Cards,Get GST  invoice and save up to 28% on business purchases.",,,"1,499",Back to results,,,,,"Mush Bamboo Wooden Bath Mat- Non Slip Quick Drying Mat for Bathroom,Kitchen,Patio,SPA,Sauna etc.Made with Water-Resistant Organic Bamboo Wood with Anti Slip Silicone Pads (1,Natural Bamboo) 40*60"," No Cost EMI , Bank Offer , Partner Offers ",https://www.amazon.in/dp/B0BNBVHKZW,,,
B089T7Z74M,,"https://images-na.ssl-images-amazon.com/images/G/01/x-locale/common/grey-pixel.gif,https://m.media-amazon.com/images/S/aplus-media-library-service-media/0caa47bb-8a54-4656-a207-1b31dc4beaab.__CR0,0,970,600_PT0_SX970_V1___.png,https://images-na.ssl-images-amazon.com/images/G/01/x-locale/common/grey-pixel.gif,https://m.media-amazon.com/images/S/aplus-media-library-service-media/da9f8efd-ea49-4881-a213-b8e89784603b.__CR0,0,970,600_PT0_SX970_V1___.png,https://images-na.ssl-images-amazon.com/images/G/01/x-locale/common/grey-pixel.gif,https://m.media-amazon.com/images/S/aplus-media-library-service-media/927ab390-7409-40be-ae4f-4228b2ba2fc3.__CR0,0,970,600_PT0_SX970_V1___.png,https://images-na.ssl-images-amazon.com/images/G/01/x-locale/common/grey-pixel.gif,https://m.media-amazon.com/images/S/aplus-media-library-service-media/6f6bebef-8b00-4d8b-8512-cb5723294110.__CR0,0,970,600_PT0_SX970_V1___.png,https://images-na.ssl-images-amazon.com/images/G/01/x-locale/common/grey-pixel.gif,https://m.media-amazon.com/images/S/aplus-media-library-service-media/a5bac0b0-2bf3-4017-8e1a-970a07b7af29.__CR0,0,970,600_PT0_SX970_V1___.png,https://images-na.ssl-images-amazon.com/images/G/01/x-locale/common/grey-pixel.gif,https://m.media-amazon.com/images/S/aplus-media-library-service-media/f48fdcd8-be11-4ade-bf89-7c3a4e4c46fa.__CR0,152,1080,668_PT0_SX970_V1___.png,https://images-na.ssl-images-amazon.com/images/G/01/x-locale/common/grey-pixel.gif,https://m.media-amazon.com/images/S/aplus-media-library-service-media/111c6cbb-368c-496b-8de5-79c7723c73ee.__CR0,0,970,600_PT0_SX970_V1___.png",Made with Love in India,,,," CE, ISO, WHO, NABL Lab & SITRA Certified with BFE > 99% (Bacteria and virus filtration Efficiency)  , Multilayer with Meltblown Filters for Safety & Hot Air Cotton for Comfort  ",,,8 June 2020,Unisex,,,"https://m.media-amazon.com/images/I/41kotwx3NQL.jpg,https://m.media-amazon.com/images/I/A1RqRCyMObL.jpg,https://m.media-amazon.com/images/I/41ptBcowGAS.jpg,https://m.media-amazon.com/images/I/31UDbAReWMS.jpg,https://m.media-amazon.com/images/I/51L-CdnkVVS.jpg",,,,,,,,,,,,,20 count,,,,,Back to results,4.1,624 global ratings,10% Instant Discount up to INR 300 on Federal Bank Debit Card Trxns. Minimum purchase value INR 150010% Instant Discount up to INR 300 on Federal Bank Credit Card Trxns. Minimum purchase value INR 20005%  Instant Discount up to INR 250 on HSBC Cashback Card Credit Card Transactions. Minimum purchase value INR 1000Get GST  invoice and save up to 28% on business purchases.,,"Mush N95 Face Mask : Soft, Reusable 6 layered face mask (Pack of 20). CE, ISO, FDA Certified and NABL, SITRA lab tested",,https://www.amazon.in/dp/B089T7Z74M,,,220 g
B09W5NZMPJ,799,"https://images-na.ssl-images-amazon.com/images/G/01/x-locale/common/grey-pixel.gif,https://m.media-amazon.com/images/S/aplus-media-library-service-media/7a233eb8-3fa8-467a-9635-afa61fcff038.__CR0,0,970,600_PT0_SX970_V1___.png,https://images-na.ssl-images-amazon.com/images/G/01/x-locale/common/grey-pixel.gif,https://m.media-amazon.com/images/S/aplus-media-library-service-media/32615080-6c58-4a83-805b-fe748e365932.__CR1000,361,2000,2000_PT0_SX300_V1___.jpg,https://images-na.ssl-images-amazon.com/images/G/01/x-locale/common/grey-pixel.gif,https://m.media-amazon.com/images/S/aplus-media-library-service-media/6c3fc9d3-2ae4-4a7b-9873-fe75b117b020.__CR0,0,2500,2500_PT0_SX300_V1___.jpg,https://images-na.ssl-images-amazon.com/images/G/01/x-locale/common/grey-pixel.gif,https://m.media-amazon.com/images/S/aplus-media-library-service-media/3ff4a99f-8b48-4b8c-88d9-d70e37ac7900.__CR0,500,2000,2000_PT0_SX300_V1___.jpg,https://images-na.ssl-images-amazon.com/images/G/01/x-locale/common/grey-pixel.gif,https://m.media-amazon.com/images/S/aplus-media-library-service-media/44204984-c78c-4659-9d7f-38eb45828aaa.__CR1,0,4042,2500_PT0_SX970_V1___.jpg,https://images-na.ssl-images-amazon.com/images/G/01/x-locale/common/grey-pixel.gif,https://m.media-amazon.com/images/S/aplus-media-library-service-media/54ce388f-569f-4a36-93ff-1d7f70928336.__CR0,0,970,600_PT0_SX970_V1___.jpg,https://m.media-amazon.com/images/S/aplus-media-library-service-media/b5efed3d-0840-4852-8050-eafa275cade8.__CR0,0,1500,3000_PT0_SX150_V1___.jpg,https://m.media-amazon.com/images/S/aplus-media-library-service-brand-media/34123fdcda8fd58ba9562d4b9368dd21.w1500.h1875.__CR477,0,938,1875_PT0_SX150_V1___.jpg,https://m.media-amazon.com/images/S/aplus-media-library-service-media/4943d041-e861-43f6-ba83-2ba1d8a0184e.__CR0,0,1500,3000_PT0_SX150_V1___.jpg,https://m.media-amazon.com/images/S/aplus-media-library-service-media/cfe9d0d6-7302-4ee6-8cfa-5a220f13e58b.__CR0,0,1500,3000_PT0_SX150_V1___.jpg,https://m.media-amazon.com/images/S/aplus-media-library-service-media/b0d2cfac-8560-41eb-a3a1-8c405c986b0c.__CR0,0,1500,3000_PT0_SX150_V1___.jpg,https://m.media-amazon.com/images/S/aplus-media-library-service-media/abcb155c-44f1-4df2-bcde-76dd08f343f7.__CR0,0,1500,3000_PT0_SX150_V1___.jpg","Give your hard-working feet the comfort it deserves with Mush Performance Bamboo socks with built-in lightweight Terry Cushion for extra comfort and with mesh design for ventilation.The Bamboo fibres used in Mush socks can be 40% more absorbent than cotton fibres. Thus, Mush socks absorb the sweat from your body in a jiffy helping you keep dry with a soft and silky touch to your feet.Engineered to fit the contours in your feet to perfection using a breathable fabric that offers great comfort and supports versatile athletic activities, a great choice for regular work-outs, running, indoor & outdoor sports, and everyday casual use.",,,," Care Instructions: Machine Wash  , Innovative Design : Give your hard-working feet the comfort it deserves with Mush Performance Bamboo socks with built-in lightweight Terry Cushion for extra comfort and with mesh design for ventilation.  , Breathable & Thermo-regulating : The Bamboo fibres used in Mush socks can be 40% more absorbent than cotton fibres. Thus, Mush socks absorb the sweat from your body in a jiffy helping you keep dry with a soft and silky touch to your feet.  , Casual/Sports Wear : Engineered to fit the contours in your feet to perfection using a breathable fabric that offers great comfort and supports versatile athletic activities, a great choice for regular work-outs, running, indoor & outdoor sports, and everyday casual use.  ",,India,22 March 2022,Men,,25%,,,,,,,,,,,,,,3.00 count,"Avail No Cost EMI on select cards for orders above ₹3000,Upto ₹59.90 discount on select Credit Cards, Federal Bank Debit Cards,Get GST  invoice and save up to 28% on business purchases.",,,599,Back to results,3.9,120 global ratings,10% Instant Discount up to INR 300 on Federal Bank Debit Card Trxns. Minimum purchase value INR 150010% Instant Discount up to INR 300 on Federal Bank Credit Card Trxns. Minimum purchase value INR 20005%  Instant Discount up to INR 250 on HSBC Cashback Card Credit Card Transactions. Minimum purchase value INR 1000No cost EMI available on select cards. Please check 'EMI options' above for more details.Get GST  invoice and save up to 28% on business purchases.,,"Mush Bamboo Ultra Soft, Anti Odor, Breathable, Anti Blister Ankle Socks for Men & Women for Running, Sports & Gym (Pack of 3) Free Size"," No Cost EMI , Bank Offer , Partner Offers ",https://www.amazon.in/dp/B09W5NZMPJ,,,200 g
B08K8WVL5L,999,"https://images-na.ssl-images-amazon.com/images/G/01/x-locale/common/grey-pixel.gif,https://m.media-amazon.com/images/S/aplus-media/sc/428c7aa8-812a-4580-badf-4c4eb47d4335.__CR0,0,600,180_PT0_SX600_V1___.jpg,https://images-na.ssl-images-amazon.com/images/G/01/x-locale/common/grey-pixel.gif,https://m.media-amazon.com/images/S/aplus-media/sc/e89a191d-c117-4563-bfb3-c7b17aacce83.__CR0,1344,4800,1485_PT0_SX970_V1___.jpg,https://images-na.ssl-images-amazon.com/images/G/01/x-locale/common/grey-pixel.gif,https://m.media-amazon.com/images/S/aplus-media/sc/6bef5eff-4587-4a88-bc2b-4ebc8e4252f8.__CR0,0,3891,3891_PT0_SX220_V1___.jpg,https://images-na.ssl-images-amazon.com/images/G/01/x-locale/common/grey-pixel.gif,https://m.media-amazon.com/images/S/aplus-media/sc/3a330ac1-c508-4778-9d19-caee30773ea4.__CR0,0,500,500_PT0_SX220_V1___.jpg,https://images-na.ssl-images-amazon.com/images/G/01/x-locale/common/grey-pixel.gif,https://m.media-amazon.com/images/S/aplus-media/sc/34fcc8b4-8aac-449b-9efc-b6e91fb42794.__CR480,0,3664,3664_PT0_SX220_V1___.jpg,https://images-na.ssl-images-amazon.com/images/G/01/x-locale/common/grey-pixel.gif,https://m.media-amazon.com/images/S/aplus-media/sc/35e3327c-67d3-43f1-9c06-acdec3d6b260.__CR0,78,236,236_PT0_SX220_V1___.jpg,https://images-na.ssl-images-amazon.com/images/G/01/x-locale/common/grey-pixel.gif,https://m.media-amazon.com/images/S/aplus-media/sc/a1343ca9-475e-47f3-8908-f4d87c97fce7.__CR0,0,500,500_PT0_SX300_V1___.jpg,https://images-na.ssl-images-amazon.com/images/G/01/x-locale/common/grey-pixel.gif,https://m.media-amazon.com/images/S/aplus-media/sc/11b6fddb-07c4-4721-8c0a-b5018e86958d.__CR0,0,500,500_PT0_SX300_V1___.jpg,https://images-na.ssl-images-amazon.com/images/G/01/x-locale/common/grey-pixel.gif,https://m.media-amazon.com/images/S/aplus-media/sc/e0dd1436-5918-492c-97af-f2fb5432213c.__CR0,0,500,500_PT0_SX300_V1___.jpg,https://images-na.ssl-images-amazon.com/images/G/01/x-locale/common/grey-pixel.gif,https://m.media-amazon.com/images/S/aplus-media/sc/348a415a-52fe-4aea-b4c0-ef779edb4a4b.__CR0,0,500,500_PT0_SX300_V1___.jpg,https://images-na.ssl-images-amazon.com/images/G/01/x-locale/common/grey-pixel.gif,https://m.media-amazon.com/images/S/aplus-media/sc/a1343ca9-475e-47f3-8908-f4d87c97fce7.__CR0,0,500,500_PT0_SX300_V1___.jpg,https://images-na.ssl-images-amazon.com/images/G/01/x-locale/common/grey-pixel.gif,https://m.media-amazon.com/images/S/aplus-media/sc/11b6fddb-07c4-4721-8c0a-b5018e86958d.__CR0,0,500,500_PT0_SX300_V1___.jpg,https://images-na.ssl-images-amazon.com/images/G/01/x-locale/common/grey-pixel.gif,https://m.media-amazon.com/images/S/aplus-media/sc/e0dd1436-5918-492c-97af-f2fb5432213c.__CR0,0,500,500_PT0_SX300_V1___.jpg,https://images-na.ssl-images-amazon.com/images/G/01/x-locale/common/grey-pixel.gif,https://m.media-amazon.com/images/S/aplus-media/sc/348a415a-52fe-4aea-b4c0-ef779edb4a4b.__CR0,0,500,500_PT0_SX300_V1___.jpg,https://images-na.ssl-images-amazon.com/images/G/01/x-locale/common/grey-pixel.gif,https://m.media-amazon.com/images/S/aplus-media-library-service-media/a39a219d-f8de-4e2f-8780-6a0da4136457.__CR0,0,970,300_PT0_SX970_V1___.jpg,https://images-na.ssl-images-amazon.com/images/G/01/x-locale/common/grey-pixel.gif,https://m.media-amazon.com/images/S/aplus-media/sc/7c58bdf3-2d71-4fba-8e81-0220b84ecca7.__CR0,0,1500,1500_PT0_SX135_V1___.jpg,https://images-na.ssl-images-amazon.com/images/G/01/x-locale/common/grey-pixel.gif,https://m.media-amazon.com/images/S/aplus-media/sc/0840de60-6cec-438e-b40d-989d99070a27.__CR155,87,517,517_PT0_SX135_V1___.png,https://images-na.ssl-images-amazon.com/images/G/01/x-locale/common/grey-pixel.gif,https://m.media-amazon.com/images/S/aplus-media/sc/114f4ed6-44d2-41cb-b405-c8ee25f7bd57.__CR15,0,330,330_PT0_SX135_V1___.jpg,https://images-na.ssl-images-amazon.com/images/G/01/x-locale/common/grey-pixel.gif,https://m.media-amazon.com/images/S/aplus-media/sc/eace8bc3-a9dd-4026-850d-827dc0898d9a.__CR12,353,908,908_PT0_SX135_V1___.jpg,https://m.media-amazon.com/images/S/aplus-media-library-service-media/6d079ffa-6ed1-4056-8bf6-f9c621673d01.__CR0,0,1500,3000_PT0_SX150_V1___.jpg,https://m.media-amazon.com/images/S/aplus-media-library-service-media/293591db-9d83-4e73-bb39-9743ea7864f6.__CR318,0,1500,3000_PT0_SX150_V1___.jpg,https://m.media-amazon.com/images/S/aplus-media-library-service-media/99e49902-6b04-4d42-8a7e-806b8c0ab4aa.__CR0,0,800,1600_PT0_SX150_V1___.jpeg,https://m.media-amazon.com/images/S/aplus-media-library-service-media/3068d7c0-8cea-40fe-87ce-230d94f628e2.__CR0,0,640,1280_PT0_SX150_V1___.jpeg,https://m.media-amazon.com/images/S/aplus-media-library-service-media/08840dd3-f0f4-41a9-8945-7263f568a518.__CR0,0,640,1280_PT0_SX150_V1___.jpeg,https://m.media-amazon.com/images/S/aplus-media-library-service-brand-media/ae24c17adb394c202a0d1bd18be7eb26.w2000.h3000.__CR250,0,1500,3000_PT0_SX150_V1___.jpg","Mush Hand Towels blends luxury design with functional fabric that last for long duration. They are odor free as bamboo fabric allows it to breathe which prevents stinky towel smells common in other gym towels. Quick drying off the skin after swimming, workouts, backpacking, or even hot yogaThey come in interesting color range for every occasion that makes a perfect gift for your family and friends! Hand towels are premium & luxurious which can be unique gift offering for bridesmaid gifts, bachelorette party favors and wedding favors.In Picture:Mush 100% Bamboo Hand/GYM Khakhi Towels: Ultra Soft, Super AbsorbentThey come in interesting color range for every occasion that makes a perfect gift for your family and friends! Turkish towels are premium & luxurious which can be unique gift offering for bridesmaid gifts, bachelorette party favors and wedding favors.In Picture:Mush 100% Bamboo Hand/GYM Olive Green Towels: Ultra Soft, Super AbsorbentThey come in interesting color range for every occasion that makes a perfect gift for your family and friends! Turkish towels are premium & luxurious which can be unique gift offering for bridesmaid gifts, bachelorette party favors and wedding favors.In Picture:Mush 100% Bamboo Hand/GYM Dark Blue Towels: Ultra Soft, Super AbsorbentThey come in interesting color range for every occasion that makes a perfect gift for your family and friends! Turkish towels are premium & luxurious which can be unique gift offering for bridesmaid gifts, bachelorette party favors and wedding favors.In Picture:Mush 100% Bamboo Hand/GYM Blue Towels: Ultra Soft, Super AbsorbentTurkish Towels are sized : 29.5"" X 59""inches (Easy to fold)Mush Turkish towels helps you to wrap yourself in freshness every day, every time. You can use Mush Turkish towel as a scarf on the outside, as a shawl on the terminal & as a travel blanket on an airplane. They are gentle enough and skin sensitive to carry babies and toddlers.Face Towels are sized : 14"" X 14"" inches (Pocket friendly – Square shaped)Our Face towels are exquisitely made to be thicker than usual cotton towels which enables it to work up a good lather during bath time, the face/wash towel can even be used to clean serious mess like sweat, dust & make-up.Bath Towels are sized: 59"" X 29"" inches.Mush bathroom towels are extremely delicate in touch while absorbing all traces of moisture efficiently from body skin. These bathroom towels are able to withstand wear and tear, and they are 600 GSM, breathable and dry fast as well as ultra in nature.Give your hard working feet the comfort it deserves with Mush Performance Bamboo socks with built in Terry Cushion for extra comfort and with mesh design for ventilation. The bamboo Fabric provides a thermo regulating cover to your feet thereby reducing sweat.Available colours- Grey, White, Black and Navy Blue.",,,," Ultra Soft : Mush Hand towels are designed with ultra-soft bamboo fibers that is suitable for sensitive skin. Mush Towel retains softness even after multiple washes.  , Super Absorbent : The Bamboo Fabric is more absorbent & breathable than any other fabric due to a wider cross section. This allows it to absorb 3x times more water while preventing dampen odor common in other cotton towels.  , Multipurpose : 2 pcs of 29.5"" x 14"" perfect sized towels for Napkin/ home, poolside, bathroom, Beach, sauna, college dorm room, spa or gym use. Different colors for you to pick  , Beautifully Packed: Your Hand towel set comes carefully packed in an eco-friendly fabric bag which makes it convenient to carry it along at work / travel / Gym. For every occasion our hand towel set makes a perfect gift for your family and friends!  ",,,,,,35%,"https://m.media-amazon.com/images/I/41UV7cNhbeL.jpg,https://m.media-amazon.com/images/I/A1iiVXGkqZL.jpg,https://m.media-amazon.com/images/I/5197dul+YlL.jpg,https://m.media-amazon.com/images/I/41l+zrrf-ZL.jpg,https://m.media-amazon.com/images/I/4156ZUnhBpL.jpg,https://m.media-amazon.com/images/I/41z8mAdvAeL.jpg,https://m.media-amazon.com/images/I/412uy4tqQqS.jpg",,,,,,,,,,,,,,"Avail No Cost EMI on select cards for orders above ₹3000,Upto ₹48.67 discount on select Credit Cards,Get GST  invoice and save up to 28% on business purchases.",,,649,Back to results,4.2,908 global ratings,,,"Mush 600 GSM Hand Towel Set of 2- Cream & Green | 100% Bamboo |Ultra Soft, Absorbent & Quick Dry Towel for Gym, Pool, Travel, Spa and Yoga | 29.5 x 14 Inches"," No Cost EMI , Bank Offer , Partner Offers ",https://www.amazon.in/dp/B08K8WVL5L,,,
B0BC99R3K8,"1,499","https://images-na.ssl-images-amazon.com/images/G/01/x-locale/common/grey-pixel.gif,https://m.media-amazon.com/images/S/aplus-media-library-service-media/20ca7f25-a076-48a1-ae60-c93c439e1374.__CR0,0,970,600_PT0_SX970_V1___.png,https://images-na.ssl-images-amazon.com/images/G/01/x-locale/common/grey-pixel.gif,https://m.media-amazon.com/images/S/aplus-media-library-service-media/511cb215-5025-4eca-9e3f-a3c8fcf82992.__CR0,0,970,600_PT0_SX970_V1___.png,https://images-na.ssl-images-amazon.com/images/G/01/x-locale/common/grey-pixel.gif,https://m.media-amazon.com/images/S/aplus-media-library-service-media/7910a4df-8737-401c-bd0b-f87c2cf79b50.__CR0,0,970,600_PT0_SX970_V1___.png,https://images-na.ssl-images-amazon.com/images/G/01/x-locale/common/grey-pixel.gif,https://m.media-amazon.com/images/S/aplus-media-library-service-media/579a28c0-7e5b-494c-ad96-8edeec08879e.__CR0,0,970,600_PT0_SX970_V1___.png,https://images-na.ssl-images-amazon.com/images/G/01/x-locale/common/grey-pixel.gif,https://m.media-amazon.com/images/S/aplus-media-library-service-media/e9f7eb13-2ab9-42c2-b8a8-d957c4c7e056.__CR0,0,970,600_PT0_SX970_V1___.png",,,,," SKIN-FRIENDLY : Mush hooded towels are composed of bamboo fiber, which is naturally hypoallergenic and free of any additives that could affect the sensitive skin of kids. As a result, our hooded baby towel is a safe, natural, and first choice for kids.  , SUPER ABSORBENT : The Bamboo Fabric is more absorbent & breathable than any other fabric due to a wider cross section. This allows it to absorb 4x times more water while preventing dampen odor common in other cotton towels.  , SOFTER THAN SOFT : The bamboo fabric is super-soft and gentle on the skin. The towel is made from bamboo which provides a silky soft touch while absorbing all traces of moisture efficiently from the body's surface. The soft plush fabric ensures comfort, longevity, and absorbency.  , KIDS ESSENTIAL : When you’re checking off Kids’ essentials, “Mush baby hooded towel,” is at the top of the list. Whether it’s for a boy or girl, or you’re looking for a unisex gift, helps make life a little easier for your fellow parents.  , QUALITY : unique designs, made up with soft and skin friendly fabric. Hooded towels are value-priced.  ",,,,,,40%,"https://m.media-amazon.com/images/I/41e69y4gGYL.jpg,https://m.media-amazon.com/images/I/518VCZjYBrL.jpg,https://m.media-amazon.com/images/I/41nPV6jNP4L.jpg,https://m.media-amazon.com/images/I/41q0pe+tReL.jpg,https://m.media-amazon.com/images/I/41MPDsTsC7L.jpg,https://m.media-amazon.com/images/I/41QVGXhj6SL.jpg",,,,,,,,,,,,,,"Avail No Cost EMI on select cards for orders above ₹3000,Upto ₹67.42 discount on select Credit Cards,Get GST  invoice and save up to 28% on business purchases.",,,899,Back to results,4.2,8 global ratings,,,"Mush Ultra Soft & Super Absorbent Bamboo Hooded Towel for Kids (1, Blue)"," No Cost EMI , Bank Offer , Partner Offers ",https://www.amazon.in/dp/B0BC99R3K8,,,
